20170720|http://www.nasdaq.com/article/rptbunge-overhaul-is-latest-shakeup-for-struggling-grain-sector-20170720-00628|RPT-Bunge overhaul is latest shake-up for struggling|By Karl Plume CHICAGO, July 19- Global grain trader Bunge Ltd's sweeping plans to overhaul its business and cut costs may not be enough to
20170720|https://www.bibeypost.com/canada-pension-plan-investment-board-has-lowered-dow-chem-co-com-dow-holding-shorts-at-myos-rens-tech-myos-lowered-by-0-67/|Canada Pension Plan Investment Board Has Lowered|The stock of Dow Chemical Co (NYSE:DOW) earned “Buy” rating by Deutsche Bank on Friday, October 23. The firm has “Hold” rating given on Monday,
20170721|http://www.greensboro.com/news/schools/n-c-a-t-might-raise-admission-standards/article_03e0d346-3a5a-5e14-9b16-453012b578bc.html|N.C. AT might raise admission standardsSchools|Timothy King is a retired vice president of Dow Chemical Co. N.C. AT ranks among nation’s best-value colleges for African-Americans. GREENSBORO — N.C.
20170721|http://www.delawareonline.com/story/money/business/2017/07/21/delaware-court-chancery-schedule-july-24-july-28/499052001/|Delaware Court of Chancery schedule, July 24 to July 28|Delaware Court of Chancery schedule, July 24 to July 28 Schedule of Delaware Court of Chancery hearings Check out this story on delawareonline.com:
20170721|https://www.bloomberg.com/news/articles/2017-07-21/spending-against-ryan-s-border-tax-jumps-even-as-its-chances-dim|Spending Against Ryan’s Border Tax Jumps Even as Its|Dow Chemical Co. and . General Electric Co., have said it would foster U.S. business and that a strengthening dollar would offset the higher price of goods
20170721|http://www.cnbc.com/2017/07/21/california-considers-banning-a-farm-pesticide-trumps-epa-supports.html|California considers banning a farm pesticide Trump's|A widely used farm pesticide that the Trump administration refused to ban could get restricted in California.
20170721|http://www.greensboro.com/news/schools/new-chairman-picked-for-n-c-a-t-board/article_f77ce436-28a7-51f0-a211-e30e59b1e7ca.html|New chairman picked for N.C. AT boardSchools|Timothy King is a retired vice president of Dow Chemical Co.
20170722|http://overnewsmagazine.com/2017/07/22/national-cinemedia-inc-ncmi-stake-increased-by-gotham-asset/|National CineMedia, Inc. (NCMI) Stake Increased by|Its up 0.18, from 1.34 in 2016Q3. Arrowpoint Asset Management Llc holds 1.66% of its portfolio in National CineMedia, Inc. for 7.13 million shares. The
20170722|http://famososartistas.com/2017/07/22/corning-incorporated-glw-stake-increased-by-peapack/|Corning Incorporated (GLW) Stake Increased by Peapack|On the other hand, Dow Chemical Co (NYSE:DOW)'s stock exchanged hands 4.34 Million shares versus average trading capacity of 5.09 Million shares.
20170722|http://fumbleboard.com/2017/07/22/national-cinemedia-inc-nasdaq-ncmi-stock-price-while/|National Cinemedia Inc (NASDAQ:NCMI) Stock Price|Analysts await Dow Chemical Co (NYSE:DOW) to report earnings on July, 27 before the open.
20170722|http://nolopodrasdejardever.com/2017/07/aperio-group-llc-purchases-95901-shares-of-vodafone-group/|Aperio Group LLC Purchases 95901 Shares of Vodafone|Finally, Jefferies Group LLC set a GBX 232 ($3.03) target price on shares of Vodafone Group plc and gave the company a buy rating in a report on Saturday
20170723|http://nolopodrasdejardever.com/2017/07/united-told-they-can-have-chelsea-star-for-50m/|United Told They Can Have Chelsea Star for £50m|Dow Chemical Co (DOW) Sets 52-Week High; Strong Momentum for Holders Virtus Investment Advisers Inc decreased Lennar Corp (NYSE:LEN) stake by
20170723|http://healthcaremenu.net/2017/07/23/tiedemann-wealth-management-llc-increases-stake-in-dow/|Tiedemann Wealth Management LLC Increases Stake in|Palouse Cap Mgmt has invested 1.47% in Dow Chemical Co (NYSE:DOW). West Oak Capital LLC increased its stake in shares of Dow Chemical Company
20170723|http://nolopodrasdejardever.com/2017/07/dow-chemical-co-dow-sets-52-week-high-strong-momentum-for/|Dow Chemical Co (DOW) Sets 52-Week High; Strong|It closed at $85.68 lastly. MYOS RENS Technology Inc (NASDAQ:MYOS) has risen 31.03% since July 20, 2016 and is uptrending. It has underperformed by
20170723|http://wobko.net/2017/07/23/deutsche-bank-ag-reaffirms-buy-rating-for-vodafone-group.html|Deutsche Bank AG Reaffirms Buy Rating for Vodafone|About 25,194 shares traded. Dow Chemical Co (NYSE:DOW) has risen 20.72% since July 21, 2016 and is uptrending. It has underperformed by 4.16% the