19950515|http://archive.fortune.com/magazines/fortune/fortune_archive/1995/05/15/202918/index.htm|May 15, 1995 - Fortune|(FORTUNE ... But stock prices, ... The Dow cleared 1000 for the first time in 1972 and reached it again in 1973,
20021202|http://www.internationallawoffice.com/Newsletters/Environment-Climate-Change/USA/Covington-Burling/Case-Law-Update-1-1-1|Case Law Update - Newsletters - International Law Office|In Cadillac Fairview v Dow Chemical Co(2) a court of appeals held that the government was 100% liable for the clean-up of a site based on equitable factors.
20030318|https://forums.spacebattles.com/threads/dixie-chicks-remark-irks-country-fans.46329/page-4|Dixie Chicks Remark Irks Country Fans  Page 4|Dixie Chicks Remark Irks Country Fans. ... I would point out that the Dow has gone up 200+ points after it ... The fact that more and more chemical shells
20030529|http://www.gainesville.com/article/LK/20030529/News/604157589/GS/|May 29, 2003 - News - Gainesville Sun - Gainesville, FL|at 12:01 AM. Georgia Mae Dillard Adkins of Gainesville died May 20 at Shands at AGH after an extended illness. She was 86. Mrs. Adkins was born in
20030617|http://www.rcuniverse.com/forum/rc-fuels-161/223049-nitromethane.html|nitromethane - RCU Forums - RC Universe|I was given 1/2 gallon of nitromethane . ... now a subsidiary of Dow Chemical Co. since about June of 2000 is the ONLY major manufacturer of nitromethane
20030625|http://www.riverfronttimes.com/stlouis/meet-the-anarchists/Content?oid=2465837|Meet the Anarchists  Feature  St. Louis News and|Meet the Anarchists ... Dow Chemical, Dupont and IGA Grocery, as well as agricultural officials from Peru, ... they're concerned with their stock price.
20030903|https://forums.anandtech.com/threads/is-the-economy-getting-better.1133919/page-4|Page 4 - Is the economy getting better? - forums.anandtech.com|If the price of gas doubles would that not be reflective ... you're money lenders and stock holders want ... From Dow Chemical to Stienway Pianos to
20050228|https://www.bobistheoilguy.com/forums/ubbthreads.php?ubb=showflat&Number=211655|Best grease made for Polyurethane ... - Bob is the Oil Guy|AutoZone is having a Sale. So prices went up... by Oro_O 06/27/17 07:12 PM: ... Dow chemical lube. div. makes a product called valve and stem lubricant,
20050820|http://www.autobody101.com/forums/viewtopic.php?t=3469|Learn how to paint your own car! - AutoBody101.com|let me guess, the seller did not have any epoxy to sell you, so he told you what he had in stock was a better product, right? stay on target!
20060907|https://in.answers.yahoo.com/question/index?qid=20060907041120AAeC5yF|May i know a few top stock brokers in Mumbai / Bangalore|May i know a few top stock brokers in Mumbai / Bangalore who give valuable tips / recos. Need tested answers?
20060928|http://www.mothering.com/forum/13-spirituality/524779-our-church-wal-mart-supporting-nglcc.html|Our Church, Wal-Mart & supporting the NGLCC|Dow Chemical Co. Midland MI DuPont (E. I. du ... Mothering Forums  Talk Amongst Ourselves  Talk Amongst Ourselves  Spirituality  Our Church, Wal-Mart  supporting
20061127|https://ca.answers.yahoo.com/question/index?qid=20061127063451AAMAhAD|where can u buy sodium polyacrylate if possible?|Where can u buy sodium polyacrylate if possible? ... Best Answer: Dow Chemical Co. makes the polymer...contact them for a list of suppliers. It is
20070112|https://answers.yahoo.com/question/index?qid=20070112092006AAh2SjZ|Strigel Chemical Company?  Yahoo Answers|On July 1, 2006, S. Strigel Chemical Company issued $5,000,000 face value, 10%, 10- year bonds at $5,679,533. This price resulted in an 8% effective
20070130|https://answers.yahoo.com/question/index?qid=20070130214311AAcEfa2|How to get free annual report of company not only|Best Answer: You do not need to spend money in the Internet. If you are in Texas, most public libraries have Internet facilities free of charge. You are
20070228|https://answers.yahoo.com/question/index?qid=20070228024628AAUbVNf|How do you buy 'Dow' in the stock market over the internet|Best Answer: If you're talking about Dow Chemical, you go to any stock broker and purchase shares of DOW. If you're talking about Dow Jones Industrial
20070525|https://answers.yahoo.com/question/index?qid=20070525115604AAQhikk|Bhopal Disaster - Could it, would it, will it happen in|The Dow Chemical Company purchased Union Carbide in 2001 for $10.3 billion in stock and debt. Dow has publicly ... Bhopal Disaster - Could it, would it
20070611|https://answers.yahoo.com/question/index?qid=20070611183330AAyFfhz|If this Scam of Amnesty is forced on America, I foresee|If this Scam of Amnesty is forced on America, I foresee Civil Revolt , do you ? ... The Dow Chemical Co., Midland, Mich., Walgreen Co., Deerfield,
20070913|http://www.zenzoneforum.com/threads/7604-Chip-implants-linked-to-animal-tumors|Chip implants linked to animal tumors|Tackling a dilemma right out of a science fiction novel, the state Senate passed legislation Thursday that would bar employers from requiring workers to have
20071007|https://answers.yahoo.com/question/index?qid=20071007172351AAFLm9v|When purchasing stock, what are some key things to look|When purchasing stock, what are some key things to look for? ... Dow Chemical, no matter how ... Price; choose a stock with a price range that suits your
20071012|https://answers.yahoo.com/question/index?qid=20071012054953AARycJH|Is the market manipulated by a large investor to herd|Is the market manipulated by a large investor to herd investors into particular investments that ... the stock at that price ... Dow Jones Industrial
20071216|http://forums.outdoorsdirectory.com/showthread.php/22346-Installing-Floatation-Foam-in-Your-Boat|Installing Floatation Foam in Your Boat?|Installing Floatation Foam in Your Boat? ... The chemical pour in foams are not even water resistant. ... [QUOTE=alaskamokaiman;
20080115|https://answers.yahoo.com/question/index?qid=20080115094726AAYQNDd|How does one prepare for a recession?  Yahoo Answers|How does one prepare for a recession? ... it may help you because prices of things will come down due to lower demand, ... Dow Chemical, grocery
20080306|http://www.candlepowerforums.com/vb/showthread.php?191001-Removing-JB-Weld|Removing JB Weld? - CandlePowerForums|... I smashed up the old stock PR and did my own potting job with one of the ... Dow Corning makes some silicone based adhesives that ... Removing JB Weld?
20080315|http://www.skyscrapercity.com/showthread.php?p=19050530|Arlington lands international bowling campus|Arlington lands international bowling campus Projects and Construction
20080715|https://politicalchaos.wordpress.com/|Political Chaos|Political Chaos Well, at least it ... The Dow Chemical Co.’s $11 billion joint venture with Kuwait’s Petrochemical Industries Co. will be headquartered
20080715|https://terrylove.com/forums/index.php?threads%2Fwhats-up-with-potassium-chloride.21679%2F|what's up with potassium chloride??  Terry Love|what's up with potassium chloride?? ... Dow chemical has announced 45 % price increases in chemical products this ... I've diverted our water lines for the stock
20080715|https://www.michigan-sportsman.com/forum/threads/chlorinated-dioxin-furan-downstream-of-dow-tittawabawassee-watershed.22499/|Chlorinated Dioxin/Furan, downstream of Dow|Chlorinated Dioxin/Furan, downstream of Dow, Tittawabawassee Watershed Discussion in 'Sound Off (MichiganForums.com)' started by Hamilton
20081013|https://forums.novell.com/showthread.php/346892-Stock-Investing-101|Stock Investing 101 - Micro Focus Forums|The present flux in the stock market is ... NOVL). This might include stocks like General Electric (GE), Dow Chemical (DOW), Cedar ... Stock Investing 101
20081018|http://onlinetradersforum.com/threads/earnings-picks-here.56840/|Earnings Picks Here  Online Traders' Forum|MIDLAND, Mich. -- Dow Chemical Co. releases third-quarter financial results. INDIANAPOLIS -- Eli Lilly  Co. releases third-quarter financial results.
20090110|http://www.managementparadise.com/forums/marketing-management/72446-myth-economic-sovereignty.html|THE MYTH OF ECONOMIC SOVEREIGNTY|THE MYTH OF ECONOMIC SOVEREIGNTY - January 10th, 2009 ... To study that question, Dow Chemical Co. is setting up a world-wide panel of senior
20091230|https://steven3x.wordpress.com/tag/retirement/|retirement  Steven3x (Steven Lauren)|... DOW, Nasdaq, SP, energy, tech, services, medical, pharmaceutical, retail/restaurants/hotel, industrial, chemical ... Pump Prices; the State Attorneys
20100608|http://www.youtube.com/watch?v=hCmAkbxNk8c|Bhopal tragedy: Dow wants no liabilities - YouTube|Bhopal tragedy: Dow wants no liabilities NewsX. Loading... ... Live Earth 'Greenwashes' Dow Chemical Co
20100705|http://www.hotrodders.com/forum/spring-question-mr-billy-shopes-180193-2.html|Spring Question for Mr. Billy Shopes - Page 2 - Hot Rod|Spring Question for Mr. Billy Shopes: Join us, it's free! User Name: ... Herbert Dow, founder of the Dow Chemical Co. Hats off to ya'll, Now we're cooking
20100816|https://seniorassistedliving.wordpress.com/tag/assisted-living-marketing/page/5/|assisted living marketing  The 800Seniors.com Blog|... even a prime-time television ad attacking the measure. The organization represents plastic bag manufacturers such as Dow Chemical Co. and
20101215|http://www.youtube.com/watch?v=hXgQAhnS2-s|Dow CEO: Why I'm meeting with Obama - YouTube|CEO of Dow Chemical Andrew Liveris says he's meeting with the president to find the middle ground in aiding
20110117|http://www.managementparadise.com/forums/marketing-management/213216-customer-relationship-management-boeing.html|Customer Relationship Management of Boeing|Customer Relationship Management of Boeing - January 17th, 2011 ... After working for Dow Chemical Co., he took a position as sales manager at
20110310|http://www.youtube.com/watch?v=RGWNfMfoSjU|BC Product Stewardship Model - YouTube|BC Product Stewardship Model Return-It. Loading ... How Dow Chemical Co. is addressing product
20110712|http://www.indianjobtalks.com/forum/showthread.php?t=7602|www.bhimrajka.com IMPEX LTD Mumbai : Sales|BHIMRAJKA IMPEX LTD. http://www.bhimrajka.com Keywords: Sales, coordination, marketing, polymer, ... Dow Chemical Co, Cabot etc as their
20111215|https://runatec.wordpress.com/category/internet/|internet – Runatec|Posts about internet written by pachacutec ... Nos gusta la tecnología, uno de los referentes de ella fue Steve Jobs, hace un año que el fundador de
20120204|https://allwheeldriveauto.com/which-coolant-is-right-for-my-subaru/|Which Coolant is Right For My Subaru? - All Wheel|Which Coolant is Right For My Subaru? ... I was advised by the parts guy that they do stock it and the cost ... I appreciate you getting me a quote on Long
20120416|http://www.skyscrapercity.com/showthread.php?t=974736&page=58|Thailand Energy Infrastructure part 2 - Page 58|Page 58- Thailand Energy Infrastructure part 2 Infrastructure and ... 26/03/2012 at 02:55 Dow Chemical Co is pouring an additional US$125 million into
20120505|http://www.youtube.com/watch?v=BBGFXMp4iJg|Investment in Sustainable Fracking Technology|Video embedded http://www.profitableinvestingtips.com/investing-trading/investment-in-sustainable-fracking-technology ... The price tag was $45 Billion ... Dow Chemical
20120516|https://lexpertmag.wordpress.com/2012/05/|May 2012 – Lexpert Magazine – Blog - WordPress.com|... that the firm has won a US$2.16-billion ruling — one of the largest arbitration awards ever — for its client, Dow Chemical Co.,
20120516|http://www.youtube.com/watch?v=dmee_xcuBmw|Audio Bristol Twp 3 Alarm Tank Fire 51612 Part-1|Audio Bristol Twp 3 Alarm Tank Fire 51612 Part-1 ... Lightning Struck a Chemical Tank at the Dow Chemical Co. in ... Audio Bristol Twp 3 Alarm
20120803|http://www.skyscrapercity.com/showthread.php?t=1464819&page=4|Thailand Alternative Energy Projects - Page 4 - SkyscraperCity|Page 4- Thailand Alternative Energy Projects Infrastructure and ... 26/03/2012 at 02:55 Dow Chemical Co is pouring an additional US$125 million into
20120811|http://beaelliott.blogspot.com/2012/08/what-happens-on-cafo-stays-on-cafo.html|PROVOKED: What Happens on a CAFO - Stays on a CAFO|. What Happens on a CAFO - Stays on a CAFO
20121027|http://www.goldismoney2.com/threads/r-t-m-chow-oct-22nd-26th-43rd-ed-debates-to-end-economy-still-weak.38593/|R.T.M. <chow> : Oct 22nd-26th > 43rd ed. ~ Debates to|R.T.M. chow : Oct 22nd-26th  43rd ed. ~ Debates to end : economy still weak... ... Update: Dow Chemical Co - 2,400 Jobs Bay Medical Center - 27
20130101|https://www.thetruckersreport.com/truckingindustryforum/threads/need-info-on-installing-a-dump-valve.199769/page-5|Need info on installing a dump valve  Page 5|Need info on installing a dump valve Discussion in ' ... Most trailer dealers will have a dump valve in stock and they are not very ... Dow chemical
20130306|http://www.youtube.com/watch?v=GeWQ9-FEdAs|Dow Jones Industrial Average News - NEW YORK,|Video embedded Dow Jones Industrial Average News - NEW YORK, Microsoft Corp, European Union, Mike Santoli ... Dow Chemical Co. - Duration:
20130307|http://www.youtube.com/watch?v=eNj96E6O8r8|Tech News - Dow Chemical, IPad, Facebook, Apple|Video embedded Dow Chemical buys NuvoSun for solar shingles Dow Chemical said Thursday it has bought solar startup NuvoSun, which developed
20130422|https://www.turbodieselregister.com/threads/242390-LOE-s-go-House-to-House-Preforming-Illegal-Warrantless-Searches|LOE's go House to House: Preforming Illegal Warrantless|The police are further allowed to use vision enhancement equipment as long as it is accessible to the public, Dow Chemical Co. v. United States.
20130502|http://www.youtube.com/watch?v=IvveZr0D_9Y|How to Stay Out of Debt: Warren Buffett - Financial|Video embedded Berkshire Hathaway acquired 10% perpetual preferred stock of Goldman Sachs. ... Buffett also helped Dow Chemical pay for its $18.8
20130523|http://thespiritoftruth.blogspot.com/2013/05/puetz-eclipse-crash-window-opens-again.html|The Spirit Of Truth Blog: Puetz eclipse crash window opens|Puetz eclipse crash window opens again... ... Dow 12K  The Anomalous Motion ... quote taken from A Treasury of Serbian Orthodox Spirituality
20130603|http://mysingaporenews.blogspot.com/2013/06/shangrila-dialoge-china-must-take.html|Shangrila Dialogue - China must take the initiative|Shangrila Dialogue - China must take ... It seems that Al Qaeda has acquire chemical ... It's not a matter of whether China must take the initiative
20131030|http://www.youtube.com/watch?v=-NO70TPegnQ|DuPont Canada Spotlight: Elizabeth Thompson|DuPont Canada Spotlight: Elizabeth Thompson and Sharon Rossi RyersonFEAS. Loading
20140323|http://www.youtube.com/watch?v=mnl4Xvy2e3s|All the way -- from collection to recycled product - YouTube|Video embedded All the way -- from collection to recycled product oneplanetnz. Loading ... How Dow Chemical Co. is addressing product stewardship
20141214|http://www.youtube.com/watch?v=y4HiZJK1t6w|Taipak - Total Solutions For Your Flexible|Our warehouse offers in-stock aluminum foil stand-up zip-lock pouches ... TOTAL SOLUTIONS FOR YOUR FLEXIBLE PACKAGING NEEDS ... The Dow Chemical Company
20150413|http://www.ejinsight.com/20150413-why-china-stocks-in-HK-have-more-upside/|Why China stocks in HK have more upside - ejinsight.com|DuPont and Dow Chemical Co. have won US antitrust approval to merge on condition that the companies sell certain crop protection products and other
20150608|http://www.skyscrapercity.com/showthread.php?t=1824068|Ethiopia Beats Nigeria as Top African FDI Destination|Ethiopia Beats Nigeria as Top African FDI Destination Business, ... Ethiopia Beats Nigeria as Top African FDI Destination. ... Dow Chemical Co.,
20150619|http://www.youtube.com/watch?v=TegvM7N8Fds|auto liquid bagging machine soup spices filling|auto liquid bagging machine soup spices filling sealing packaging line preformed bag packer system For
20150701|http://www.youtube.com/watch?v=-PJCGwSlptk|This Week’s Growth  Income Stock: LyondellBasell (LYB|Video embedded This Week’s Growth  Income Stock: LyondellBasell (LYB) ZacksInvestmentNews. ... LyondellBasell: http://www.zacks.com/stock/quote/lyb?... Dow Chemical
20150813|http://www.youtube.com/watch?v=PoM5it04-bA|Global Chemicals for Cosmetics & Toiletries Market 2015|Video embedded Unsubscribe from Market Research Store? Global Chemicals for Cosmetics  Toiletries Market Outlook (2014-2022)
20150920|https://www.thetruckersreport.com/truckingindustryforum/threads/kingpin-setting.295342/|Kingpin Setting  TruckersReport.com Trucking Forum|#1 + Quote Reply. Trucking Jobs in 30 ... Most of the flatbeds I've seen are 30 kingpin setting. ... Dow chemical/Amsty Hanging... Gunner75 posted Jun
20160227|http://politicalhotwire.com/current-events/140475-scalias-death-costs-dow-%24835-million.html|Scalia's Death Costs Dow $835 Million - Political Hotwire|Dow Chemical Co. said it agreed to pay $835 million to settle an antitrust case pending before the U.S. Supreme Court after Justice Antonin Scalia’s
20160227|https://www.stormfront.org/forum/t1145871/|Report: Dow to pay $835 million to settle lawsuit, cites|Report: Dow to pay \\\5 million to settle lawsuit, cites Scalia's death mlive.com, February 26, 2016 Report: Dow to pay \\\5 million to settle law
20160516|http://www.youtube.com/watch?v=MYNbHZ5u9G8|Billionaire George Soros Exposed - YouTube|Billionaire George Soros ... Soros sold a stake in Level 3 Communications Inc. which was worth $173 million as of Dec. 31 and a holding in Dow Chemical Co
20160529|http://www.mmo-champion.com/threads/2002177-Chemical-Safety-bill-passes-House-with-overwhelming-support|Chemical Safety bill passes House with overwhelming support|Chemical Safety bill passes House with overwhelming ... Trade groups representing Dow Chemical Co., ... Chemical Safety bill passes House with overwhelming support;
20160911|https://www.thetruckersreport.com/truckingindustryforum/threads/trailer-swing-clearance.323909/|Trailer swing clearance  TruckersReport.com Trucking|Trailer swing clearance Discussion in ' ... Of course their stock model has a short neck but the dealer is specing me one with the ... Dow chemical/Amsty
20161004|http://www.youtube.com/watch?v=hz6eg-3Y-Ss|Dow Chemical Co - Hot or Not - YouTube|Video embedded The Dow Chemical Co. manufactures and supplies products used primarily as raw materials in the manufacture of customer products and
20161019|http://www.njacs.org/events-calendar/oct-19-2016-nmr|Oct 19, 2016 – NMR Symposium  North Jersey Section|– NMR Symposium. ... The North Jersey ACS NMR Topical Group and Princeton ACS Section present the 5th Annual NMR Symposium. Date:. ... Dow Chemical Co.
20161120|http://woodworkerszone.com/igits/showthread.php?p=291538|epoxy - WoodworkersZone - Woodworking Forums|... four basic epoxy resin manufacturing license in the United States, Dow Chemical co. And Reichho1d epoxy compounds the company established a
20170423|http://www.ronpaulforums.com/showthread.php?509992-Dow-Chemical-asks-Trump-admin-to-set-aside-pesticide-studies|Dow Chemical asks Trump admin to set aside pesticide studies|MIDLAND, MI -- The Associated Press reports The Dow Chemical Co. and two other pesticide makers are pushing the Trump administration to set aside
20170520|http://www.sec.marketwatch.com/story/andrew-liveris-appointed-co-chair-of-saudi-us-ceo-forum-2017-05-20|Andrew Liveris Appointed Co-chair of Saudi-U.S. CEO|MIDLAND, Mich.,(BUSINESS WIRE) -- Andrew Liveris, Dow’s chairman and chief executive officer, has been appointed co-chair of the
20170705|http://www.process-heating.com/topics/2673-chemicals-petrochemicals|Chemicals/PetrochemicalsProcess Heating|Semantic Designs (SD) was awarded a contract extension by the Dow Chemical Co. to provide continuing support and enhancements to SD’s custom,
20170710|https://seekingalpha.com/article/4086784-long-term-effects-low-oil-prices-dow-chemical|The Long-Term Effects Of Low Oil Prices On Dow Chemical|The short-term effect of low oil prices is clearly positive. The long-term effects of low oil prices on Dow Chemical might be more mixed than people expect
20170715|http://www.weatherforddemocrat.com/news/local_news/gulf-water-authority-to-replace-aging-pump-station/article_777c5d88-030f-5346-9082-f764fba122d2.html|Gulf water authority to replace aging pump station|HOUSTON — For the first time since its inception, the Gulf Coast Water Authority has to replace a pump station to secure a vital supply of cooling water
20170716|http://www.european-rubber-journal.com/2017/07/16/erj-people-talent-tracker/|ERJ PeopleSkills Tracker - European Rubber Journal|The discussions follow the announcement of a global reorganisation by parent company Dow Chemical Co. which will see the reduction of its workforce by
20170716|http://www.washingtontimes.com/news/2017/jul/16/texas-gulf-coast-water-authority-to-replace-pump-s/|Texas: Gulf Coast Water Authority to replace pump|HOUSTON (AP) - For the first time since its inception, the Gulf Coast Water Authority has to replace a pump station to secure a vital supply of cooling
20170717|http://www.nasdaq.com/article/china-approves-two-new-gmo-crops-for-import--agri-ministry-20170717-00081|China approves two new GMO crops for import - agri|Last month, it approved Dow Chemical Co's DOW.N Enlist corn and Monsanto's Vistive Gold soybeans. But four more products are still waiting for approval.
20170717|http://www.cnbc.com/2017/07/17/reuters-america-update-3-dupont-monsanto-urge-transparent-gmo-crop-reviews-in-china.html|UPDATE 3-DuPont, Monsanto urge transparent GMO|BEIJING, July 18 (Reuters) - Global seeds giants have called for transparent, science-based approvals processes for new crop types after China
20170718|http://overnewsmagazine.com/2017/07/18/dow-chemical-company-the-dow-shares-bought-by-yorkbridge/|Dow Chemical Company (The) (DOW) Shares Bought by|Comparatively, 1.1% of FMC Corporation shares are held by insiders. Cadence Bankshares Na has 0.12% invested in Dow Chemical Co (NYSE:DOW)
20170718|http://www.stltoday.com/reuters/china-approves-monsanto-and-syngenta-corn-for-import/article_9c23f54f-6c47-50ac-86d3-477c89f04c4c.html|China approves Monsanto and Syngenta corn for import|The government last month gave the go-ahead to Dow Chemical Co.'s Enlist corn and Monsanto's Vistive Gold soybeans. Four other products owned by
20170718|http://www.delawareonline.com/story/money/business/2017/07/18/peltz-takes-aim-procter-gamble-playbook-dupont-fight/487914001/|Peltz takes aim at ProcterGamble with playbook from|He also finalized a merger with The Dow Chemical Co., a deal that Kullman had been working when she ran the company.
20170718|http://www.nasdaq.com/article/lindsay-appoints-dows-timothy-hassinger-to-succeed-rick-parod-as-ceo-20170718-00231|Lindsay Appoints Dow's Timothy Hassinger To Succeed|(RTTNews.com) - Lindsay Corp. (LNN), a manufacturer of irrigation equipment, announced Tuesday the appointment of Timothy Hassinger as president
20170718|https://www.yahoo.com/news/dupont-monsanto-urge-transparent-gmo-crop-reviews-china-032241017--sector.html|DuPont, Monsanto urge transparent GMO crop reviews|By Dominique Patton BEIJING (Reuters) - Global seeds giants have called for transparent, science-based approvals processes for new crop types after China
20170719|http://www.cnbc.com/2017/07/19/reuters-america-bunge-overhaul-is-latest-shake-up-for-struggling-grain-sector.html|Bunge overhaul is latest shake-up for struggling grain|Dow Chemical Co and DuPont are merging, China's ChemChina will buy Syngenta AG and Bayer AG has snapped up Monsanto Co. It was Bunge's own chief
20170719|http://www.delawareonline.com/story/money/2017/07/19/dupont-begins-marketing-country-club-sale/492095001/|Want to buy a country club? DuPont's is officially for sale|DuPont has divested its hospitality assets ahead of its pending $137 billion merger with the Dow Chemical Co. Scheduled to be completed in August,
20170719|https://seekingalpha.com/article/4088600-calyxt-inc-regulatory-hurdles-keep-us-cautious-otherwise-exciting-ipo|Calyxt Inc.: Regulatory Hurdles Keep Us Cautious On This|It faces competitors such as Monsanto Co. , Dow Chemical Co. and many specialty providers of seeds and other agricultural products. Conclusion
20170719|http://www.nasdaq.com/article/bunge-overhaul-is-latest-shakeup-for-struggling-grain-sector-20170719-01467|Bunge overhaul is latest shake-up for struggling grain|By Karl Plume CHICAGO, July 19- Global grain trader Bunge Ltd's sweeping plans to overhaul its business and cut costs may not be enough to
20170719|http://thefacts.com/news/article_d09b0d45-1259-596e-9a30-a92800274012.html|Freeport won’t dig too deep at golf courseNews|A subsurface lease agreement approved Monday by City Council gives Dow Chemical Co. long-term access to all property deeper than 22 feet at the
20170720|http://fumbleboard.com/2017/07/20/rational-advisors-llc-invests-323000-in-dow-chemical/|Rational Advisors LLC Invests $323000 in Dow Chemical|The stock of Dow Chemical Co (NYSE:DOW) has Buy rating given on Thursday, December 10 by Deutsche Bank. Citigroup has Neutral rating and $89 target.
20170720|http://www.midwestmessenger.com/news/people_and_industry/new-lindsay-ceo-from-dow-agri-sciences/article_d6a5f6b0-6d8a-11e7-a74e-038e8ae98669.html|New Lindsay CEO from Dow Agri-Sciences|Hassinger, 55, currently serves as president and CEO of Dow AgroSciences, headquartered in Indianapolis. Dow AgroSciences, a subsidiary of The
20170720|http://healthcaremenu.net/2017/07/20/sell-side-analysts-predictions-rpc-inc-res-the-dow-chemical/|Sell-Side Analyst's Predictions: RPC, Inc. (RES), The Dow|As per Thursday, September 29, the company rating was maintained by Maxim Group. More interesting news about Dow Chemical Co (NYSE:DOW) were
