20140415|http://www.outdoorsmenforum.ca/showthread.php?t=48994|gold panning - Alberta Outdoorsmen Forum|I've found it in certain washes around Norgeg. The battle river has some in spots but I've not spent enough time with research there to make much hay.
20100520|https://www.gearslutz.com/board/so-much-gear-so-little-time/494369-soundclips-gap-pre-73-vs-art-tube-mp.html|SOUNDCLIPS: GAP Pre-73 vs. ART Tube MP - Gearslutz|SOUNDCLIPS: GAP Pre-73 vs. ART Tube MP. ... After the solid performance of the ART here, I may take it to my buddy's studio to A/B against his Great River
20141021|http://www.youtube.com/watch?v=XCpDei-fmXQ|Golden Adventure on the River Ivalojoki - YouTube|Golden Adventure on the River Ivalojoki Janne Korkko. Loading ... Ivalojoki- The gold river canoe
20131120|http://www.youtube.com/watch?v=q3UrZTqCcWo|Golden River Team Cup 2013 - YouTube|Video embedded Golden Play-Off. Semifinale. Athletic Bilbao - Villarreal - Duration: 3:38. AFL Media 142 views. 3:38. CISAG : Trampoline - Golden River
20140520|https://www.theguardian.com/film/2014/may/20/lost-river-cannes-review-ryan-gosling|Cannes review: Lost River - Ryan Gosling flounders with|Video embedded Cannes review: Lost River - Ryan Gosling flounders with directorial debut 2 / 5 stars The first film in which Ryan Gosling
20100726|https://answers.yahoo.com/question/index?qid=20100726150057AAheKp9|What wild animals live in New Mexico?  Yahoo Answers|What wild animals live in New Mexico? 10 mammals? 10 reptiles? 10 amphibians? 10 fish? 10 birds? 10 insects? plz plz plz help! i need an answer asap!!
20130514|http://www.youtube.com/watch?v=oMBtverjlpY|Leyland Cypress Gold Rider - YouTube|Larry O'Neil of Larry's Garden Design and Installation takes you through the wonderful world of the Leyland Cypress Gold Rider
20141220|http://www.youtube.com/watch?v=Dbl0cleo9xg|The Golden Nightingale Orchestra - Red river rock|Sign up for YouTube Red by July 4th for uninterrupted ... No thanks Try it free. Find out why Close. The Golden Nightingale Orchestra - Red river
20100127|http://www.youtube.com/watch?v=mlFBuTfHq0M|100 Western Movies - YouTube|Music from Audio Swap Library: Alcazar (Stairway) (not Ennio Morricone)100 Western Movies (Tips for
20140724|http://www.youtube.com/watch?v=z4nJX8snP4s|Fifty Shades Of Grey - Official Teaser Trailer (HD) - YouTube|Video embedded Fifty Shades of Grey – In Theaters Valentine’s Day Advance Tickets On Sale Now http://unvrs.al/FiftyShadesTickets Pre-order the Fifty
20130403|http://www.youtube.com/watch?v=3II0M8BpL-g|Yangtze Sinorama Gold 8 Cruises Chongqing|Yangtze Sinorama Gold 8 Cruises Chongqing-Yichang -Chongqing China - Croisiere en Chine Simon Sinorama. Loading ... The Yangtze River
20110118|https://answers.yahoo.com/question/index?qid=20110118233002AAdIfUq|GRAMMAR HELP 10 POINTS?  Yahoo Answers|A single GROVE of trees HAVE ALREADY TURNED golden IN THE COOLER WEATHER. (Points : 3) ... (Points : 3) On the bank of the river were
20151012|http://www.youtube.com/watch?v=ynguP36tV60|West Virginia State Wildlife Ctr, gray wolf|This gray wolf resides at the West Virginia Wildlife Center in French Creek, West Virginia. I had never heard a
20121031|http://www.youtube.com/watch?v=rap8PFhK9Xg|Grand Maison Subdivision in Mandeville LA - YouTube|Video embedded Standard YouTube License; Show more Show less. Loading... Autoplay When autoplay is enabled, a suggested video will automatically
20120603|http://www.treasurenet.com/forums/ohio/52914-gold-ohio.html|Gold In Ohio|finding gold in ohio creeks, glod deposit in and around ohio river millcricke, gold in ohio creeks, gold in ohio rivers, gold recovered in ross county ohio,
20151209|http://www.youtube.com/watch?v=DY_dsDbRtFA|BIG4 Mildura Golden River Holiday Park (Powered Site|Video embedded Skip navigation Sign in. Search
20141031|http://www.youtube.com/watch?v=pkBvfdWnz20|The Polar Express Train Ride at the Colorado|For the first time in the history of the Colorado Railroad Museum, ... The Polar Express Train Ride at the Colorado Railroad Museum
20140127|http://www.youtube.com/watch?v=L0ZH3UNNt-U|BIGFOOT Best Evidence 2014 - Sightings of|BIGFOOT Best Evidence 2014 - Sightings of Sasquatch, Yeti  Bigfoot COMPILATION PARANORMAL
20150716|http://www.youtube.com/watch?v=6YfS7m4DYTM|Golden Grotto River Trace with Hualien|Golden Grotto River Trace with Hualien Outdoors(ADVANCED ... The Golden Grotto Taiwan Hualien water ... River tracing: golden
20160629|http://www.youtube.com/watch?v=_RJjfH06BtY|越南房地产。VINHOMES GOLDEN RIVER。在城市|VINHOMES GOLDEN RIVER. 钻石地点。0909.235.228 高档房地产项目会涨价的理由。 按专家分析中心
20140528|http://www.youtube.com/watch?v=qMpp8IFL64E|Mark Knopfler - Sultans of Swing (Fender|Mix - Mark Knopfler - Sultans of Swing (Fender Stratocaster) YouTube; Dire Straits Sultans Of Swing (1978)
20120730|http://www.youtube.com/watch?v=bAlnBM6xqQk|River City Extension - Golden Tongue [Thanatopsis|River City Extension stopped in Birmingham to do a Nervous Energies session while on tour with The Drowning
20110118|http://www.youtube.com/watch?v=UtuWvi0fkb4|Sad Keanu BBC interview - YouTube|Keanu Reeves talks on the BBC Breakfast Show about his Sad Keanu meme whilst trying to remain cool.
20150119|http://www.youtube.com/watch?v=Vat_no_StOE|Golden River - youtube.com|Video embedded Provided to YouTube by The Orchard Enterprises Golden River  Paul Robeson Paul Robeson ℗ 2010 Pickwick Group Ltd Released
20170614|http://www.sarkarimirror.com/the-minister-of-state-for-youth-affairs-and-sports-ic-water-resources-river-development-and-ganga-rejuvenation-shri-vijay-goel-and-the-president-of-aiff-shri-praful-patel-in-a-group-photograph/|Sarkarimirror  India top Bureaucracy News provider|The Minister of State for Youth Affairs and Sports (I/C), Water Resources, River Development and Ganga Rejuvenation, Shri Vijay Goel and the
20151017|http://www.youtube.com/watch?v=xSevZ6ZyCsQ|Golden River Competition Newnan High School|Golden River Competition Newnan High School April Payne. Loading... Unsubscribe from April
20120213|http://www.youtube.com/watch?v=5MfCrHXN-Hs|Saddle Boy --- Slim Dusty - YouTube|Mix - Saddle Boy --- Slim Dusty YouTube; Johnny Ashcroft - Little boy lost - Duration: 4:02. janschro
20150924|http://www.youtube.com/watch?v=iYQj546Ukls|The Golden Toadstools - Weeping River (Minaret) - YouTube|Video embedded Rating is available when the video has been rented
20140527|http://www.youtube.com/watch?v=djLp7F9oS08|SHORE THING - Line Dance -- Présentée par Martine à|Video embedded SHORE THING Chorégraphie de Eddie Huffman (US) - mars 2011 Musique : Shore Thing de Luke Bryan (96 BPM) (CD : Spring Break 3)
20110526|http://www.goldenretrieverforum.com/choosing-golden-retriever-breeder-puppy/97940-warning-about-jo-meister-river-run-goldens.html|A warning about Jo Meister and River Run Goldens - Golden|I have an update on my puppy and River Run Goldens, and unfortunately I would no longer recommend working with Jo Meister. When I first talked to Jo
20100726|http://www.youtube.com/watch?v=11OphZ-CDUE|The Golden Hinde and River Thames - YouTube|The replica of Drake's ship, the Golden Hinde, in dock at Southwark, London, SE1, and a view of the River
20161110|http://www.youtube.com/watch?v=EoF7L8HbTtQ|[CCR.VN]_DỰ ÁN VINHOMES GOLDEN RIVER - YouTube|Video embedded ... _DỰ ÁN VINHOMES GOLDEN RIVER ... - Công ty Cổ Phần Dịch Vụ Bất Động Sản Trung Tâm Thành Phố_City Central Real Estate Corporation
20141021|http://www.contractortalk.com/f10/vinyl-plank-flooring-114067/|Vinyl Plank Flooring - Flooring - Contractor Talk|Vinyl plank flooring with the look and feel of real wood...ha! Have you guys worked with this before? I was told it could go down over VCT that has been
20110314|http://www.youtube.com/watch?v=jbLmlg02yGE|Old Man River: The Golden Gate Quartet USA|Old Man River: The Golden Gate Quartet USA bodoildi1. Loading ... Paul Robeson - Ol' Man River
20120625|http://www.youtube.com/watch?v=UWH3vFQhC1o|Oasis - Live Manchester 2005 HD Full Concert|Oasis fue una banda británica de rock formada en Mánchester en 1991. Inicialmente conocida como The Rain, la
20110904|http://m14forum.com/m16-ar15/102603-ea-15-a.html|Ea-15? - M14 Forum|Ea-15? This is a discussion on Ea-15? within the M16 AR15 forums, part of the Rifle Forum category; What can you guys tell me about Eagle Arms EA-15?
20110306|http://www.youtube.com/watch?v=tOqhmp7CnJk|Glenwood Springs to Moab UT with GoPRO|Glenwood Springs to Moab UT with GoPRO DestinationPharmD. Loading... Unsubscribe from
20150525|http://www.youtube.com/watch?v=TcjbhhGLOCE|Golden Star - Green River - YouTube|Golden Star - Green River Vendel Jakus. Loading ... A Golden Star együttes 2015-ös Nosztalgia
20120921|http://www.youtube.com/watch?v=UE8yHySiJ4A|The Largest Galaxy in the Universe: IC 1101|The Largest Galaxy in the Known Universe [IC 1101] - Duration: 4:49. FinalFrontier 640,665 views. 4:49. Deep
20140530|http://www.youtube.com/watch?v=8oJ3ODnQirE|Where go the boats? / On go the boats. - YouTube|Where go the boats? By Robert Louis Stevenson. On go the boats. By James David Chapman. Where go the boats? Dark brown is the river. Golden
20160405|http://www.youtube.com/watch?v=MHynMYcJ1zg|The Curse of Sleeping Beauty Official Trailer 1|The Curse of Sleeping Beauty Official Trailer 1 (2016) - Ethan Peck, India Eisley Movie HD IN THEATERS:
20140415|http://www.youtube.com/watch?v=gtRMamyrE1w|The Golden Toadstools - Weeping River - YouTube|The Golden Toadstools - Weeping River (Minaret) - Duration: 3:10. Fonsoul Bcn 66 views. 3:10. The
20160522|http://www.youtube.com/watch?v=8d8u2SCRoc0|VINHOMES GOLDEN RIVER BA SON PHONG CÁCH ĐẾ|Video embedded Vingroup mở bán đợt 1 Vinhomes golden river cảng ba son hứa hẹn thu hút các nhà đầu tư trong và ngoài nước.Dự án bao gồm khu
20130224|http://www.youtube.com/watch?v=XXgj7_8nqVc|Alice in Wonderland (Full Ride : HD Front Seat|Alice in Wonderland (Full Ride : HD Front Seat POV) ... Jurassic Park The Ride River Adventures Front
20120730|http://www.youtube.com/watch?v=Ftirz5fA8Ck|Life in Whistler - The River of Golden Dreams - YouTube|Video embedded Life in Whistler - The River of Golden Dreams G Stevenson. Loading... ... River of Golden Dreams - Guided Canoe Tour - Duration: 3:19.
20140808|http://www.youtube.com/watch?v=-oQdS3GokeM|Colorado State Record Tiger Trout - YouTube|As many of you know Tiger Trout are mostly genetically engineered fish often only found in Private waters in
20130704|http://www.youtube.com/watch?v=spgb4JxagCw|6 Ways to Improve Your Watercolor Paintings:|Develop your watercolor skills more quickly by avoiding these six mistakes often made by beginning painters.
20110423|http://visitagraindia.blogspot.com/2011/04/fun-facts-of-agraindia.html|Fun Facts of Agra,India|Fun Facts of Agra,India ... its chord lying parallel to the Yamuna River and stretches for ... white in the day and changes its color to golden in the
20110308|http://www.youtube.com/watch?v=n-abxpFT8JI|$55,900 3 Bed 2 Bath Mobile on own Land, 407 Golden|Video embedded $55,900 3 Bed 2 Bath Mobile on own Land, 407 Golden Hinde, Gold River, Vancouver Island TahsisRealty. Loading
20110124|http://knitjones.blogspot.com/2011/01/nuptials.html|Knit Jones: Nuptials|Nuptials I can't believe ... tea has a surprisingly bold flavor, though balanced with a delicate fruitiness that is a bright as the gorgeous golden colour
20160520|http://www.youtube.com/watch?v=DPW4FagKoxw|Căn hộ vinhomes golden river bason saigon quận 1|Video embedded vinhomes golden river otosaigon, Chi tiết: http://canho-chungcu.com/tim-hieu-chi...,,,,vinhomes golden river tuyển dụng, vinhomes golden river
20131104|http://www.youtube.com/watch?v=J9o_jbN0cBM|Dragon's Law - NEW - Slot Machine Bonus|Dragon's Law - NEW - Slot Machine Bonus - Konami Casinomannj - Creative Slot Machine Bonus Videos.
20110210|http://www.youtube.com/watch?v=3Kqh8FsdyWU|How to draw Willie Wonka from Charlie and the|Step by step instructions on how to draw Willie Wonka from Charlie and the Chocolate Factory. I drew
20101101|http://trailparkreviews.blogspot.com/2010/11/south-mineral-campground-silverton.html|South Mineral Campground, Silverton ... - blogspot.com|South Mineral Campground, Silverton Colorado ... there are numerous dispersed campsites along the road and beside the river; ... Golden Colorado, A New
20100924|http://www.youtube.com/watch?v=7dMBKgSlUPg|Goose that Laid the Golden Egg - YouTube|Goose that Laid the Golden Egg HooplaKidz ... The Golden Egg - Aesop's Fables In Malayalam
20100924|http://www.youtube.com/watch?v=010KyIQjkTk|Kris Kross - Jump - YouTube|Music video by Kris Kross performing Jump. (C) 1992 Sony BMG Music Entertainment
20110904|http://www.youtube.com/watch?v=MPkMg2RmZe4|Salmon Underwater Attacks at the Golden Gate|Salmon attack video trailer at Golden Gate fishing With FBR™ lures some great underwater attack video
20111124|http://www.youtube.com/watch?v=eMZbTexaeDI|Captain Chaos - A Golden Fish Swimming Up a River|Video embedded Captain Chaos - A Golden Fish Swimming Up a River bank melancholyhill. Loading... Unsubscribe from melancholyhill? Cancel