20160506|http://www.youtube.com/watch?v=TyXrvOYi-LE|Vinhomes Golden River - Đỉnh Cao Của Cuộc|Vinhomes Golden River - Đỉnh Cao Của Cuộc Sống Thượng Lưu Vinhomes Ba Son Nhà Đẹp Vinhomes.
20120608|http://www.youtube.com/watch?v=mC_5hQxWGgQ|Dead Boy - Sits up in Coffin - Asks Dad for drink|-- 'Dead' boy sits up in coffin, asks for water and dies again in Brazil ... -- Dead Brazilian Boy Wakes Up And Asks For Water
20120328|http://www.youtube.com/watch?v=vbucJO3zDCE|Inside a Russian Billionaire's $300 Million Yacht|Inside a Russian Billionaire's $300 Million Yacht Wall Street Journal. Loading... Unsubscribe from Wall
20120603|http://www.youtube.com/watch?v=zHF7viVJnJg|Diamond Jubilee River Pageant: The Best Bits|A montage of the best bits of the Queen's Diamond Jubilee River Pageant on the Thames, involving a
20110602|http://www.youtube.com/watch?v=UlBTNT1-9AQ|kelly willis "little honey" - YouTube|Dwight Yoakam and Kelly Willis - Golden ring - Duration: 3:18. ... Kelly Willis - River Of Love 1990 - Duration:
20110405|http://www.youtube.com/watch?v=gAqlaHnOw74|George Jones Brother To The Blues - YouTube|George Jones - Brother To The Blues - Duration: 2:50. ... George Jones Golden Hits - Duration:
20110530|http://www.youtube.com/watch?v=u2ZlF0WQjT0|Sailing Down This Golden River - Arlo & Sarah|Arlo  Sarah Lee Guthrie performing Sailing Down This Golden River with Abe Guthrie, Gordon Titcomb,
20161020|http://www.skyscrapercity.com/showthread.php?t=662978&page=53|SAIGON  Vinhomes Golden River  U/C - Page 53|Page 53- SAIGON  Vinhomes Golden River  U/C Saigon ... Thất vọng , mà không ngạc nhiên khi PA này đc chọn vì toà cao ốc này là khách sạn chứ
20130829|http://www.youtube.com/watch?v=uQ2iIAsAm7U|Magical Mantovani Moments! [HD] - YouTube|Mix - Magical Mantovani Moments! [HD] YouTube; Romantic Strings Mega Music Album! (2 Hours)
20110613|http://www.youtube.com/watch?v=RnGgu6MgYkI|Tandem canoe backferry - YouTube|Tandem canoe backferry Paul Mason. Loading ... Whitewater River Running Technique with Anna Levesque ... 3 Golden
20130718|http://www.youtube.com/watch?v=Z23ttP1a7Wc|The Glorious Sons - mama - YouTube|The Glorious Sons - Mama (Official) - Duration: 3:15. TheGloriousSons 949,414 views. 3:15. 50+ videos Play all Play now; Mix - The Glorious Sons - mama
20110319|http://northernillinoisbirder.blogspot.com/2011/03/house-finch-northern-illinois-winter.html|House Finch, Northern Illinois winter birds|House Finch, Northern Illinois winter birds In the dead of winter, ... White-crowned Sparrows, Golden-crowned Kinglets, Rusty Blackbirds,
20160116|http://www.youtube.com/watch?v=2AoT2amqf2Q|Dự Án Vinhomes Ba Son Q1 - Vinhomes Golden|Dự án căn hộ Vinhomes Ba Son hay Vinhomes Golden River sở hữu vị trí vàng “Độc Tôn” chiến lược trong
20111231|https://forum.bodybuilding.com/showthread.php?t=140964941&pagenumber=1|Misc. - Bodybuilding.com|https://forum.bodybuilding.com/showthread.php?t=174153971. 12-31-2011, 10:37 AM #10. stefano445. View Profile View Forum Posts Registered User Join
20150120|https://forestedgehikes.wordpress.com/2015/01/20/river-road-erbacher-and-golden-harvest-preserves/|River Road, Erbacher, and Golden Harvest Preserves|The Roxbury Land Trust's brochure describes the trails through the River Road, Erbacher, and Golden Harvest Preserves. Trail Conditions:
20111208|https://answers.yahoo.com/question/index?qid=20111208174010AAO76nt|How Do I Figure Out My Bank Transit Number With ScotiaBank|This Site Might Help You. RE: How Do I Figure Out My Bank Transit Number With ScotiaBank? Trying to set up PayPal using ScotiaBank and my
20121017|http://www.goldenretrieverforum.com/choosing-golden-retriever-breeder-puppy/93732-pups.html|Pups - Golden Retrievers : Golden Retriever Dog Forums|HI Has anyone heard of Golden grove kennels or goldngrove golden retrievers in Vineland NJ
20140402|http://www.youtube.com/watch?v=Mp7rWsVVwjg|THE SNARE Trailer - YouTube|Video embedded THE SNARE Trailer Directed by C.A. Cooper Starring Eaoifa Forward, Rachel Warren, Dan Paton Release Date : Genre : Psychological Horror THE SNARE Trailer
20150119|http://www.youtube.com/watch?v=0x6XxBY4MfQ|DayZ Epoch - Golden River - YouTube|Video embedded DayZ Epoch - Golden River Dodo Rebel. Loading ... Episode 10 - Die Schlacht um Golden River - Duration: 21:07. Hart aber Herzlich
20131014|http://www.youtube.com/watch?v=wwv7tVuyqJ8|The Top 5 Biggest Bodybuilders Of All Time|The Top 5 Biggest Bodybuilders Of All Time TOP 5 BODYBUILDERS IN HISTORY A Tribute To The Best
20130224|http://www.youtube.com/watch?v=MHuIU7njszo|GOLDEN RETRIEVER PUPPY- LEXI - "This is how|Golden Retriever pups swimming in the pool for the first time - Duration: 3:26. Clear Passion 1,012,125 views. 3:26. Golden
20141129|http://www.playstationtrophies.org/forum/dragon-age-inquisition/253542-grace-dalish-bugged.html|By The Grace Of The Dalish Bugged? - PlaystationTrophies.org|By The Grace Of The Dalish Bugged? User Name: Remember Me? Password: Register: FAQ: Awards: ... You could also find and return a golden Halla
20141031|http://www.youtube.com/watch?v=nPzmpiI6N14|BRUISES Line Dance (Dance  Teach in French)|BRUISES Line Dance (Dance  Teach in French) eric lecardonnel. Loading ... Bruises - Line Dance (Dance  Teach
20120529|http://www.youtube.com/watch?v=m_D8GRFqX8E|Top 50 best songs of the 70's - YouTube|Video embedded This is a list of the best songs of the 70's decade (1970 to 1979) Skip navigation Sign in. ... Top 50 best songs of the 70's
20151227|http://www.youtube.com/watch?v=js8E6C3ZnJ0|Hegemony - 10 Minute Philosophy - Terms|Unsubscribe from 10 minute Philosophy? In this episode, we define the term Hegemony. Please fee free to
20140530|http://www.youtube.com/watch?v=J8X_ntk73mc|ALKANLAR YAPI'DAN GOLDEN RİVER TERMAL KENT PROJESİ - YouTube|Video embedded ALKANLAR YAPI'DAN GOLDEN RİVER TERMAL KENT PROJESİ hatayhaber. Loading ... Termalkent Hatay Golden River - Duration:
20140131|http://www.youtube.com/watch?v=OvSvUrw5PZo|Tyler O. Golden Gloves 2014 Fall River, Ma - YouTube|Video embedded Tyler O. Golden Gloves 2014 Fall River, Ma Big Spank. ... Golden Gloves Finals 2014 Pal Fall River Kurt - Duration: 6:38.
20160817|http://www.youtube.com/watch?v=YPTntaxCnT4|Kern River Fly Fishing Golden Trout PackTrip|Kern River Fly Fishing Golden Trout PackTrip Zach Stokke. Loading ... River Fishing in B.C. for Rainbow
20110829|http://www.youtube.com/watch?v=4gOud5B6XMY|How to identify wild Ginseng plants and the root|How to identify wild Ginseng plants and the root scannerguy1968. Loading... Unsubscribe from
20150120|http://www.youtube.com/watch?v=Y8wifV5RYr8|Houndmouth - Sedona - YouTube|Houndmouth: Sedona on David Letterman - Duration: 4:27. TheCarnegieCenter 13,203 views. 4:27. Cage
20101111|https://in.answers.yahoo.com/question/index?qid=20101111232921AAVegUv|According to vaastu shastra,having tortoise/turtles at|According to vaastu shastra,having tortoise/turtles at home is ... At one time a chinese river was flooded for a long time and when they put some
20110423|http://www.youtube.com/watch?v=YHkDCHciQOY|Bryan Ferry - Take Me To The River (HQ) - YouTube|Take Me to the River - Al Green - Duration: 4:58. ... Golden Eighties 442,440 views. 4:52. Roxy Music - More
20101108|https://answers.yahoo.com/question/index?qid=20101108044657AArUInd|5 lines about peacock in hindi?  Yahoo Answers|For the best answers, search on this site https://shorturl.im/axI1I Mor bharat ka rashtriya pakshi hai.: Peacock is the national bird of India.
20110116|http://www.youtube.com/watch?v=fzCIbhLUUA0|The Man with the Golden Gun: Car Jump - YouTube|The Man With The Golden Gun - Dinner Party - Duration: 3:17. trigger finger 146,946 views. 3:17. Roger
20161020|http://www.youtube.com/watch?v=PipQcWiWK8I|Starr's Mill wins Golden River Marching Band|Starr's Mill wins Golden River Marching Band Festival 10/15/16 Michael ... performing their original E-motions wins Golden River
20150912|http://www.youtube.com/watch?v=ctBG1euoZcs|Bring down the house - YouTube|Bring down the house 32 comptes- 4 murs 4 restarts-2 tags Intermédiaire Chorégraphes: Stéphane Cormier  Denis Henley Musique: Bring down the house
20120328|http://www.youtube.com/watch?v=ZnDGIttvDW4|How to separate your gold from your Black Sand Concentrates|Video embedded this video show's you how to separate your blonde sands and gold from your black sand concentrates. You use a magnet in this
20170511|http://www.youtube.com/watch?v=fuDsWtr6EAc|RoSaWay - Golden River - - YouTube|Video embedded Download Sarah Lee Guthrie Golden River - Duration: 4:06. Richard Sorensen 27,258 views. 4:06. Boney M. - Rivers of Babylon
20160520|http://www.youtube.com/watch?v=mGKx2_Bs2V0|Billboard Top 10 - May 2016 - Dan Ban - (Golden River|Video embedded I love country music , it's God's music. Always got to have one country song on my albums. I love doing country songs about heaven which
20141014|http://www.youtube.com/watch?v=ZKGqtSisReg|Spanish Mary - Lyrics by Bob Dylan  Lead Vocals|The New Basement Tapes - Spanish Mary with Lyrics by Bob Dylan  Lead Vocals by Rhiannon Giddens ... Lost On The River
20140711|http://www.youtube.com/watch?v=q1hIvAFuyeI|River Of Golden Dreams - YouTube|Video embedded Skip navigation Sign in. Search
20131115|http://www.youtube.com/watch?v=HbruzE5CwU0|How to draw a Scenery for children - Step by step|How to draw a Scenery for children - Step by step EthansHowToDraw. Loading... Unsubscribe from
20131115|http://www.youtube.com/watch?v=aXRVA5nUHsM|River Cottage Kapán innen kaszán túl 3 - YouTube|River Cottage Kapán innen kaszán túl 7 - Duration: 23:59. PINKÓCZI BETYÁR 15,171 views. 23:59.
20120608|http://www.youtube.com/watch?v=tDMtCzq5kf8|Gold Digger - Line Dance (Dance & Teach in|Choreographed by: Rachael McEnaney (UK) June 2012 32 count - 4 wall - Absolute Beginner level line dance Music: Gold Digger
20131224|http://www.youtube.com/watch?v=igh6cMW1iiY|Angry Birds Rio Rocket Rumble All Hidden Gold|Rocket Rumble All Golden Rocket unlocked Bonus Level,versteckte goldene Rakete for,Iphone,Android,PC,IOS,Games,iPad New Uptade Golden
20150417|http://www.youtube.com/watch?v=0or-29scmfo|Josh Beaudoin walking 240' line over river in|Josh Beaudoin walking 240' line over river in Golden Colorado Jason McDonald. Loading... Unsubscribe
20101120|http://www.youtube.com/watch?v=eOJCLHOcpdE|Best Photos near Pucon, Chile - Incl. Lake Lacar, National|Video embedded ... Chile - Incl. Lake Lacar, National Park, River Caburgua, Golden Torres ... - 10 Golden Torres by Mrjoey from ... River
20150118|http://www.youtube.com/watch?v=YNE3RxGSqCM|Log Entry - YouTube|With Pawtucket Brewery repaired, it's time to starting crafting items! First up -- the Creepy River Boat! All
20110323|https://answers.yahoo.com/question/index?qid=20110323182329AAmdW7L|what is a good name for a buckskin horse?  Yahoo Answers|what is a good name for a buckskin horse? Source(s): good buckskin horse: https: ... Golden Rose Chrysanthemum (Crissy) Daffodil Daisy Honey Lilly
20110319|http://www.youtube.com/watch?v=u3VO23pXsLc|Bella & Edward-Stay with me - YouTube|Sign up for YouTube Red by July 4th for ... Twilight Biology Class Scene Edward's Golden Eyes ... Edward Cullen - Bella's Lullaby (RIVER
20100615|http://knitjones.blogspot.com/2010/06/no-more-plywood.html|Knit Jones: No More Plywood!|No More Plywood! Our contractor done us good...he laid all of the flooring in one day and we are ever so grateful! Here are the before and afters for the
20110128|http://www.diychatroom.com/f5/trafficmaster-allure-ultra-planks-84137/|Trafficmaster Allure ULTRA! Planks - Flooring - DIY|Trafficmaster Allure ULTRA! Planks. Would like to see here if anyone bought or installed the ULTRA traffic master Allure planks now sold at home depot.
20100607|http://www.youtube.com/watch?v=WwATyRREKd8|1940's Music - YouTube|1940's Music TimeyWimey0Detector. Loading... Unsubscribe from TimeyWimey0Detector? Cancel
20150120|http://www.youtube.com/watch?v=X4VQOkZJCzg|Golden Significance Of Sabarmati River - YouTube|Video embedded ऋषि दर्शन की ऑनलाइन सदस्यता के लिए क्लिक करें---http://www.rishidarshan.org/ To
20141215|http://www.youtube.com/watch?v=CvMmeYL-2VA|Alien: River of Pain by Christopher Golden Book|More Alien action, as I review the latest Alien novel, this one by bestselling author Christopher Golden. Buy
20120426|http://www.youtube.com/watch?v=QV7CanyzhZg|The Dark Ages...How Dark Were They, Really?:|Crash Course World History is now available on DVD! Visit http://store.dftba.com/products/crash... to buy a
20120922|http://www.youtube.com/watch?v=t7GxE3H7xQ4|Karla Bonoff 13 - The water is wide - YouTube|Mix - Karla Bonoff 13 - The water is wide YouTube; ... Karla Bonoff - The water is wide lyrics 가사
20110424|http://www.youtube.com/watch?v=-2nTRAyrzUY|Mahaseer fishing in Tista River in west bengal|Mahaseer fishing in Tista River in west bengal India ashok bhardwaj. Loading ... Huge Golden Mahseer Catch in Koshi River
20140418|http://www.goldenretrieverforum.com/choosing-golden-retriever-breeder-puppy/284713-southern-cross-goldens.html|Southern cross goldens - Golden Retrievers : Golden|Golden Retrievers : Golden Retriever Dog Forums ... Southern cross goldens. Hi Does anyone know if Southern cross golden's from New Hampshire are
20130211|http://www.youtube.com/watch?v=keHwmNNxQrQ|River Phoenix - Golden Globes 1989 - YouTube|River Phoenix talks to reporter at Golden Globes, 1989 - Duration: 0:11. rivjudephoenix 1,286 views. 0:11. River
20110130|http://www.youtube.com/watch?v=gAswsM2g5Zo|How to: Catching baitfish on Sabiki rigs - YouTube|This Fishing World presentation shows you how to go about catching your own live bait using Sabiki rigs.
20100820|http://forum.babyverden.no/threads/labrador-golden-retriver.1162449/|Labrador/Golden retriver  Babyverden Forum|Labrador og golden retriver er de mest barnevennlige rasene du kan få, så sånn sett skal du være ganske trygg [:)] Men hvis hunden har hatt ett litt tøft liv til
20121101|http://www.youtube.com/watch?v=4cdK0aSiUls|Golden Stonefly - YouTube|How to tye a Golden Stonefly. Connecticut Curler. Fly Fishing. Outdoor Adventures. Farmington River in
20120130|http://www.youtube.com/watch?v=pq2LNlfKSBk|How To Pronounce Scythe - YouTube|Video embedded how to pronounce scythe. scythe pronunciation. how to say scythe. how do you pronounce scythe. how to say scythe pronounce
20111124|http://www.youtube.com/watch?v=28tdqwWDo3A|Thai Chao Phraya River ダニーボーイ ... - YouTube|Mix - Thai Chao Phraya River ダニーボーイ 【Danny Boy】 Sam Taylor YouTube; ダニーボーイ ・シル・オー
20120722|http://www.goldenretrieverforum.com/golden-retrievers-main-discussion/117639-washington-state-breeder-help.html|Washington State Breeder help? - Golden Retrievers|Does anyone have a referral or experiene with this breeder in Washington State, golden reserve.com?
20140124|http://www.youtube.com/watch?v=LiIURFm63Yk|Deep River - Mormon Tabernacle Choir - YouTube|The Mormon Tabernacle Choir and Orchestra at Temple Square present Deep River with lyrics by Marta
20121004|http://www.youtube.com/watch?v=se7yAkqu3Ek|Bill  Gloria Gaither - Four Days Late [Live] ft.|Karen Peck  New River Download on iTunes here: https: ... Mix - Bill  Gloria Gaither - Four Days Late [Live] ft. Karen Peck  New River YouTube
20110128|http://www.youtube.com/watch?v=L651xslurNk|Isgaard Back to Eden - YouTube|Isgaard Back to Eden eric0000024. Loading ... Where The River Will Flow - Duration: ... Golden Key
20110910|http://www.youtube.com/watch?v=Vn3i4JlsGBE|Gold dust rains during worship at Bethel!|Video of a worship service at bethel church in redding, CA this is a video showing a miracle of God where
20150109|http://www.youtube.com/watch?v=49KFAO5WaV4|Joaquin Phoenix Has a Crush on Amy Poehler|Joaquin reveals his crush on Amy Poehler and he explains how his mom ended up dancing with Usher.
20120101|http://www.youtube.com/watch?v=NiE_Zmg8vRE|Golden River Developments Perth Cup - December 2011 - YouTube|Video embedded Golden River Developments Perth Cup - December 2011 perthracing. Loading... ... Golden River Developments Perth Cup
20150417|http://www.youtube.com/watch?v=Mfd-a6hF1jI|Multi Day White Water Rafting - The White River near|Video embedded Our White River multi day rafting trip is amazing! 2 days white water rafting and a night camping on the riverside near beautiful lakes
20121004|http://www.youtube.com/watch?v=ygTa1mOTSo0|Angry hissing goose - YouTube|Video embedded Angry hissing goose Jfrog the Virus. Loading ... Lost baby goose found in the river ... GOLDEN EAGLE ATTACKS AND CATCHES DEER
20110806|http://www.youtube.com/watch?v=O7Qm1GrKSyU|Middle canoe seat DGM - YouTube|Directions for making a removable extra canoe seat.
20130216|http://www.youtube.com/watch?v=hRUImln53gk|Best Ever Carp Fishing dough ball bait recipe.|Best Ever Carp Fishing dough ball bait recipe. Free bait and lure Golden carp hunters ... Carp Fishing Dough Ball Bait Recipe
20150424|http://www.youtube.com/watch?v=aS-n7xoT0VY|GOLDEN RIVER CITY! - DayZ Epoch - YouTube|Video embedded Это Golden River City в DayZ Epoch Chernarus! Небольшой город на карте, находящийся в скале и по
20100504|http://www.youtube.com/watch?v=WZWKsrqK5bY|Vacation Internationale Vallarta Torre - YouTube|El mejor lugar para tus vacaciones Vallarta Torre. El mejor lugar para tus vacaciones Vallarta Torre. ... Sea River
20111011|http://www.huntingbc.ca/forum/showthread.php?72301-Hunting-Revelstoke|Hunting Revelstoke|Hunting Revelstoke Hi ... south of town on the east side of the lake/river. ... Go drive the hour and forty five min to Golden area..some good elk hunting..look
20110530|http://www.youtube.com/watch?v=Sha1S_yXTwY|Tennesse River singing call Golden State Roundup|Tennesse River singing call Golden State Roundup 2011 tom ... Beautiful Noise singing call with Bronc Wise at the 2011 Golden
20110423|http://www.youtube.com/watch?v=HyL3INa3rb0|Beef Feedlots Near Greeley/Kersey Colorado|On Highway 34 between Greeley and Kersey you can see miles and miles of cow feedlots. For more on our Greeley
20150131|https://forum.cgpersia.com/f33/graphicriver-50-golden-font-bundle-9618872-a-109960/|Graphicriver - 50 Golden Font Bundle 9618872|Graphicriver - 50 Golden Font Bundle 9618872. Graphicriver - 50 Golden Font_Bundle 9618872 Layered PSD, Photoshop ASL  251 MB. Link(s): Download;
20140402|http://www.youtube.com/watch?v=neKObkMjs0w|Myrtle Beach's Golden Mile - YouTube|Have you stayed in one of the hotels in the exclusive Golden Mile section of Myrtle Beach? If not,
20130829|http://www.youtube.com/watch?v=96yFuyx-zBA|Real Mermaid Caught on Camera (New 2016)|Real Mermaid Caught on Camera (New 2016) EinEngelSchuetzeDich. ... Real Mermaid caught on camera
20101214|http://www.youtube.com/watch?v=VW3CMrg6mFw|Styx - Golden Lark - YouTube|Styx - Golden Lark/A Song For Suzanne - Duration: 8:43. ... Styx - Boat On The River - Duration: 3:11.
20160412|http://www.youtube.com/watch?v=mKP8-QwJKGY|Giới thiệu dự án Vinhomes Golden River Bason - YouTube|Video embedded Căn hộ Vinhomes Golden River Bason - Duration: 1:32. Nguyễn Thị Loan - Tư vấn các dự án BĐS ở TP.HCM 836 views. 1:32.
20140422|http://www.youtube.com/watch?v=tA8AfQaUnXM|Ella Henderson - Ghost - YouTube|Ella Henderson - Ghost (Oliver Nelson Remix) - Duration: 5:07. The Vibe Guide 4,931,246 views. 5:07. Ellie
20140131|http://www.youtube.com/watch?v=WEv3Cn9ioYc|Sailing Down my Golden River radio performance|Sailing Down my Golden River radio performance by Pete Seeger, 1984 Jim Abbott. Loading
20101108|https://answers.yahoo.com/question/index?qid=20101108102317AAp8ZQx|Been sick please help Red badge of courage?  Yahoo Answers|Been sick please help Red badge of courage? ... The novel ends with, “Over the river a golden ray of sun came through the hosts of leaden rain clouds.”
20121017|https://uk.answers.yahoo.com/question/index?qid=20121017065505AAJWkxW|Best answer, 5 star rating, answer YOUR Q :)?  Yahoo|Best answer, 5 star rating, answer YOUR Q :) ... the gold trade in North Africa to a new golden age. ... of the Niger River made consistent trade
20101111|http://sustainablebuildingcodes.blogspot.com/2010/11/tiny-house-code-compliance-120-square.html|Sustainable Building Codes: Tiny House Code Compliance|Tiny House Code Compliance - 120 square feet exemption? Recently I have been researching some alternative temporary housing for our land in Hotchkiss.
20120927|https://uk.answers.yahoo.com/question/index?qid=20120927115545AAlrUO7|Is Volvic Strawberry-Flavored water healthy/good for|Is Volvic Strawberry-Flavored water healthy/good for you....? Hey everyone! I've recently been taking in so much of this drink (like so far
20110613|http://www.youtube.com/watch?v=VuEYlzicBYw|Golden Loop - Gold Reef City (GoPro POV)|Golden Loop - Gold Reef City (GoPro POV) James Carroll. Loading ... the Tower of Terror, the Golden Loop and the Runaway Train ... Raging River
20100616|http://message.snopes.com/showthread.php?t=61416|Beware basa (or pangas) fish - snopes.com|Beware basa (or pangas) fish. Comment: This fish is being sold in Canada. ... river dump chemicals and industrial waste directly into it. Avoid eating them
20100324|http://www.youtube.com/watch?v=kRTMWzVoT_U|Chicago Old Days - YouTube|chicago old days album: chicago 8 ... Sign up for YouTube Red by July 4th for uninterrupted music and
20110223|http://www.youtube.com/watch?v=V5wpWGnu3Ms|Subaru Dog Commercials Compilation (8|The Subaru dogs commercials compiled into one video
20130704|http://www.youtube.com/watch?v=8NTpfbcTMUY|Panchatantra Tales - Mean Friends - Short Stories|Panchatantra Tales - Mean Friends - Short Stories For Children - Animated Cartoons For Kids
20110308|http://www.youtube.com/watch?v=GlipgiuPUYw|HOW TO SET UP A POOL TABLE  A LESSON|Sign up for YouTube Red by July 4th for uninterrupted music and videos all summer. Some things
20110602|http://www.youtube.com/watch?v=wbQSAdU4Qb4|'The Hills are Alive' - The Sound of Music|The hills are alive with the sound of music With songs they have sung for a thousand years The hills fill my heart with the sound of music
20100422|http://www.youtube.com/watch?v=J9gKyRmic20|Crowded House - Don't Dream It's Over - YouTube|Video embedded Music video by Crowded House performing Don't Dream It's Over.
20141002|http://www.homebrewtalk.com/showthread.php?t=163486|Beer Styles that Cellar/Age well - Home Brew Forums|Beer Styles that Cellar/Age well General Beer Discussion
20130429|http://www.youtube.com/watch?v=a_MfIViFduM|Beatuiful Drive: Banff To Vancouver, A Timelapse|A time-lapse of what is perhaps one of the most beautiful drives in Canada, from Banff to Vancouver )About
20101205|http://www.youtube.com/watch?v=wVJVNaurXxQ|Traditional Hymns - Until Then - YouTube|Traditional Hymns - Until Then Heber Vega. Loading... Unsubscribe from Heber Vega? Cancel
20160706|http://www.youtube.com/watch?v=ETe-YFMq6AY|River Forest Golden Ingot Marching Band|River Forest Golden Ingot Marching Band  Auxiliary Corp 4th of July Parade Montage - 2016
20120417|http://www.youtube.com/watch?v=L84RQH1xZvE|Pretty Woman - YouTube|Academy Award(R) winner Julia Roberts and Golden Globe winner Richard Gere will leave you breathless in PRETTY WOMAN
20130425|http://www.youtube.com/watch?v=tR8Zw97rrX8|Tom and Jerry Kids Show Season 1 - Bat Mouse|Tom and Jerry Kids Show: ... Tom and Jerry Kids Show Season 1 - Bat Mouse Warner Bros. Home
20121213|http://www.youtube.com/watch?v=plgqLfgVRHU|top 10 walleye lures - YouTube|top 10 walleye lures Adam O. Loading... Unsubscribe from Adam O? Cancel Unsubscribe. Working
20110424|http://www.youtube.com/watch?v=uB7kRFGkRng|Every Number 1 Of The 60's (Part 1) UK ♫ - YouTube|Every Number 1 Of The 70's (Part 1) UK ♫ - Duration: 11:38. UK Music Charts 1,326,077 views. 11:38. Top
20140530|http://www.garagejournal.com/forum/showthread.php?t=9235|Welcome to the The Garage Journal Board forums.|Welcome to the The Garage Journal Board forums. You are currently viewing our boards as a guest which gives you limited access to view most
20110210|http://knitjones.blogspot.com/2011/02/ferbs.html|Knit Jones: The Ferbs|The Ferbs So, we're doing it. We're Ferberizing....Miss A has yet to sleep through the night (I think once when she was ten weeks old she slept for 10
20160926|http://www.youtube.com/watch?v=I-tAvxZjM6g|Sligo candy boy X golden river 3 year old filly - YouTube|Video embedded Sligo candy boy X golden river 3 year old filly geesala coach. Loading... Unsubscribe from geesala coach? Cancel Unsubscribe.
20120226|http://www.youtube.com/watch?v=_a6IJxj-6u0|Free Bar Ambience Sound Effect - YouTube|Free Bar Ambience Sound Effect thefreesfx. Loading... Unsubscribe from thefreesfx? Cancel Unsubscribe.
20110405|http://www.jeepforum.com/forum/f96/water-fording-snorkels-smoke-stack-golden-rules-1192199/|Water fording, snorkels, smoke stack and golden rules|Water fording, snorkels, smoke stack and golden rules? ... are there any golden rules big no no's and things to avoid doing all together? Besides a
20100307|http://www.youtube.com/watch?v=4U1l5y2rkzA|Beautiful Dreamer by Stephen Foster - YouTube|Mix - Beautiful Dreamer by Stephen Foster YouTube; Roy Orbison Beautiful Dreamer - Duration: 2:21.
20130523|http://www.youtube.com/watch?v=vrzsS1siYWE|Revolver Golden Gods 2013 - YouTube|The biggest names in hard-rock and heavy-metal rocked Los Angeles on May 2, 2013 at the fifth annual Revolver Golden
20120301|http://www.youtube.com/watch?v=8Nn5uqE3C9w|Buddha and Ashoka: Crash Course World History|Buddha and Ashoka: Crash Course World History #6 CrashCourse. Loading... Unsubscribe from CrashCourse? Cancel Unsubscribe. Working... ... Resources
