20160926|http://www.youtube.com/watch?v=ck0CamwZ8jQ|River the Golden Retriever - YouTube|Video embedded While I was doing yoga this morning, 3 1/2 month old River found himself in the mirror.
20120418|http://www.youtube.com/watch?v=ZpXqXct7I_s|How to Paint Rocks Into Cute Lady Bugs - YouTube|Welcome to the whimsy's studio on the internet in this video I will walk you through taking an natural smooth rock
20140724|http://www.youtube.com/watch?v=FJHAjJXwQDs|Alligator vs dog: Man saves his golden retriever|Alligator vs dog: Man saves his golden retriever from the jaws of huge Florida gator TomoNews US. ... A scared Golden
20140404|http://www.youtube.com/watch?v=1SDJSu2eLd8|HONKY TONK SWING - NEW SPIRIT of Country|Chorégraphie : Honky Tonk Swing Chorégraphe : Gary Lafferty, novembre 2013 Niveau : débutant Musique :
20141129|http://www.youtube.com/watch?v=G5uWcx9q0oU|Down By the Riverside - YouTube|Video embedded Unsubscribe from Golden Gate Quartet - Topic? Provided to YouTube by IDOL Down By the Riverside  The Golden Gate Quartet
20141215|http://www.youtube.com/watch?v=H8XDogfFx9k|Willy Wonka CHOCOLATE RIVER BONUS &|Willy Wonka CHOCOLATE RIVER BONUS  OOMPA LOOMPA FEATURE Las Vegas ... WILLY WONKA SLOT $5,000.00 Golden Ticket ... Willy Wonka: Chocolate River Bonus
20140418|http://www.youtube.com/watch?v=rthAYp6t0O4|Canadian Mountain Passes Full Run - Time Lapse|Canadian Mountain Passes Full Run ... As the line descends to Golden, ... New York to New Haven Full Run - Time Lapse - Train Simulator 2014
20120405|http://www.youtube.com/watch?v=YmpvpypXKf0|The Outlaws - Ghost Riders in the Sky - YouTube|Video embedded Ghost Riders (In the Sky) - Willie Nelson  Johnny Cash - Duration: 4:29. ... Golden Earring - Radar Love (1973) HD 0815007 - Duration:
20170101|http://www.youtube.com/watch?v=wHey1cMMC5s|Snake Eyes, Brocade King Blue, Golden Willows|... Brocade King Blue, Golden Willows  Yellow River 2016-2017 Billy Fabritius. ... Golden Willows (Dikke aanrader!) 4: Yellow River
20120428|http://www.youtube.com/watch?v=c5N6Y1jHms4|golden retrievers swim at the beach of Meakhong|golden retrievers swim at the beach of Meakhong river Sujin Wonglakorn. Loading ... 5 month old golden
20100517|http://www.youtube.com/watch?v=RSPlvdDAo7k|Golden Stonefly Hatch and tips on the Yakima|Golden Stoneflies hatch on the Yakima River from May-June and are a big Stonefly, usually a #6 or #8
20120130|https://answers.yahoo.com/question/index?qid=20120130125356AAIqyEk|Story of the koi jumping the dragon gate?  Yahoo Answers|This Site Might Help You. RE: Story of the koi jumping the dragon gate? Im looking for the story of how the koi fish becomes a dragon. From my
20120228|http://www.youtube.com/watch?v=KF214wDC4L8|Death of BASE Jumper Dwain Weston -- Slammed|Australian BASE jumper Dwain Weston was considered one of the world's best at the time. On October 5,
20120428|http://www.youtube.com/watch?v=6jRJnDx5HQo|Red River - Movie Theme - YouTube|Video embedded Red River is a 1948 Western film directed by Howard Hawks, giving a fictional account of the first cattle drive from Texas to Kansas along
20100209|http://www.youtube.com/watch?v=w4TgMLIUrbg|Zoo Tycoon 2 Animal Downloads Part 2 - YouTube|Galapagos Hawk/Bald Eagle* 26. Boto (Amazon River Dolphin) 27. ... Zoo Tycoon 2 Animal Downloads Part 2 Geniuswas. ... African Golden Cat 38. Asian Golden
20130312|http://www.youtube.com/watch?v=e2vprzrdkC0|Persona 4 Golden: Catching the Sea Guardian - YouTube|Video embedded Ah yes, the Sea Guardian...this guy can be a pain in the ass, both in catching and actually just setting up his spawn. The fishing mini
20121212|http://www.youtube.com/watch?v=cRqfics-kJk|1947 Jimmy Dorsey - Heartaches (the 1st MGM|Bob Carroll  Dee Parker vocal. The Metro-Goldwyn-Mayer film studio entered the commercial record
20161020|http://www.youtube.com/watch?v=xuBTx_4ffNY|Golden Suits - You're Crossing a River - YouTube|Golden Suits - You're Crossing a River Hit City U.S.A. Loading ... Golden Suits - Don't Let Love ... Crossing the River
20130523|http://www.youtube.com/watch?v=1yROwLg-2tI|Old Man - Neil Young - Acoustic Guitar Lesson|Old Man - Neil Young - Acoustic Guitar Lesson (ST-905) How to play ... How to play Harvest Moon by Neil Young (Acoustic Guitar Lesson ST
20130211|http://www.youtube.com/watch?v=jXWD6-1QG9U|TOPPOP: Long Tall Ernie  The Shakers - Golden|TOPPOP: Long Tall Ernie  The Shakers - Golden Years Of Rock TopPop. Loading... Unsubscribe from
20160412|http://www.youtube.com/watch?v=3FX2XxTzKLw|Vinhomes Golden River - YouTube|Sign up for YouTube Red by July 4th for uninterrupted music and videos all summer. Vinhomes Golden River
20170106|http://www.youtube.com/watch?v=Z46Q00tmB4U|River - Golden Age - YouTube|Video embedded IMD Subscribe for more videos: https://goo.gl/EQJw1k River https://www.youtube.com/channel/UCcaA... Indie Music Dimension Website:
20140418|http://www.youtube.com/watch?v=N2PC8doKeZw|MERLE HAGGARD LIVE FULL TRIBUTE SHOW|Jeff Golden's new song he wrote and sang called SOUTHERN is now #5 ... MERLE HAGGARD LIVE FULL TRIBUTE SHOW 2015 MERLE HAGGARD IN CONCERT Tribute
20140416|http://www.youtube.com/watch?v=xudq9R6wk1w|Smurf Mountain at Kings Dominion - YouTube|Journey through Smurf Mountain at Kings Dominion, which was in operation from 1984-1993. Great Golden
20141110|http://www.youtube.com/watch?v=xt5uJrWW1gE|Chasing Rivers, Part 1: The Colorado  Nat Geo|National Geographic Freshwater Hero Pete McBride paddled and hiked the length of the Colorado River
20150731|http://www.youtube.com/watch?v=p4HcSsTh-2Q|Goombay Dance band-Seven Tears[Lyrics]|Seven tears have flown into the river Seven tears are run into the sea If one day they ... Golden star that ... Goombay Dance band-Seven Tears[Lyrics
20121209|http://www.youtube.com/watch?v=Mp2EiLo-CTI|Christmas Peace - YouTube|A collection of beautiful instrumental Christmas songs and winter scenes. Relax and enjoy the holiday with
20150312|http://www.youtube.com/watch?v=nM35X5hdzEs|Rag’n’Bone Man - Wolves - YouTube|The debut album 'Human' is out now: http://smarturl.it/HumanDeluxe?IQid=yt ----- Subscribe to Rag'n'Bone Man
20100324|http://knitjones.blogspot.com/2010/03/school-rant.html|Knit Jones: School Rant|School Rant So, I thought this was uncool. Last night in class, the professor (who is not my advisor) ... Simmons First National Corporation (SFNC)
20120927|http://www.youtube.com/watch?v=AJ4WOLdrCOI|Kisaralik River Golden Gate Falls - YouTube|2012 Self Guided Rafting trip with Shawn Carey, Jason Gasper and Josh Grahm. This is the Golden Gate Falls as Shawn and I pass through (down) it. The river
20170217|http://www.youtube.com/watch?v=rvRa_T3deH8|Golden Jubilee of St Peter Chanel College Vava'u|Golden Jubilee of St Peter Chanel College Vava'u - Taolunga River Side Soane Gallaher. ... Golden
20120722|http://www.youtube.com/watch?v=W-crbUit9ug|Hiking to Island Lake and Titcomb Basin in Wind|Recently, Shelli Johnson, and her husband, Jerry, enjoyed an epic day hike from Elkhart Parkt to Island Lake and
20140319|http://www.youtube.com/watch?v=zrFl8BSZJbs|Runrig Book of Golden Stories - YouTube|Runrig Book of Golden Stories 100thousandrecords. Loading ... Every River - Live at Loch
20110314|http://www.youtube.com/watch?v=xDQVmMVKE_w|James Taylor - The Christmas Song - YouTube|James Taylor - The Christmas Song TransatlanticMoments. Loading ... James Taylor - River
20150525|http://www.sniperforums.com/forum/rifles/37399-howa-308-one-hole-wonder.html|Howa .308 One Hole Wonder - Sniper  Sharpshooter|Howa .308 One Hole Wonder. This is a discussion on Howa .308 One Hole Wonder within the Rifles forums, ... Rock River Arms Predator Pursuit upper on
20110922|http://www.youtube.com/watch?v=StPsutGV8hM|FREE Westerns from the 1950s - YouTube|FREE Westerns from the 1950s WesternsOnTheWeb. Loading... Unsubscribe from WesternsOnTheWeb? ... Laredo THE GOLDEN
20110904|http://www.youtube.com/watch?v=uUX5J3B3Vvg|The Golden Seal (1983) Roadshow Home Video|Roadshow Home Video Australia trailer for the film The Golden Seal (1983) Sourced from the
20121031|http://www.youtube.com/watch?v=InQ5o9doThk|Dead Queen and the River - Golden Rocket (Hank Snow cover|Video embedded Dead Queen and the River - Golden Rocket (Hank Snow cover) 75offsuit. Loading ... Dead Queen and the River feat. ... THE GOLDEN
20110319|http://www.youtube.com/watch?v=gEjM7yRU3sA|RAINY NIGHT country line dance - YouTube|RAINY NIGHT country line dance frederab. Loading... Unsubscribe from frederab? Cancel Unsubscribe.
20110318|http://www.youtube.com/watch?v=WNIPqafd4As|Céline Dion - My Heart Will Go On - YouTube|Music video by Céline Dion performing My Heart Will Go On. (C) 2007 Sony Music Entertainment Canada Inc.
20101216|http://www.youtube.com/watch?v=MdWIjtKu3-0|Fishing the Saugeen river - YouTube|Rating is available when the video has been rented. Fishing the Saugeen river for steelhead
20120129|http://www.youtube.com/watch?v=Xi8XOgu0L0g|VENTA DE CACHORROS GOLDEN RETRIEVER|VENTA DE CACHORROS GOLDEN RETRIEVER INSCRITOS Y CHIPIADOS DE BUEN PEDIGREE rodrigo
20110318|http://www.irv2.com/forums/f44/best-fifth-wheel-tires-86811.html|Best fifth wheel tires - iRV2 Forums|Best fifth wheel tires. Hi , new to forum, not rving.First fifth wheel. ... Forest River Forums Fiberglass RV Forums Wander The West Jayco RV Forum
20100726|http://www.youtube.com/watch?v=xbaLj1fWIbs|Gold River Lower Falls, Golden Ears Park, Maple|A look at Gold River Lower falls from the top, looking North, Golden ears Park, Maple Ridge, British Columbia
20141012|http://www.youtube.com/watch?v=DEQYjogtdkU|Traveling on the Uchuck III of Gold River BC|The Uchuck III is a working commercial and passenger vessel. ... Traveling on the Uchuck III of Gold River
20110526|http://www.youtube.com/watch?v=MAviyhpn7Lg|Charlie and the Chocolate Factory (2/5) Movie|Charlie and the Chocolate Factory movie ... Depp) chocolate river, ... to see the inside of his operation by placing golden
20170129|http://www.youtube.com/watch?v=bVSfNShq8oo|BANGKOK II - Archaeological Museum, river, Wat Arun|Video embedded BANGKOK II - Archaeological Museum, river, Wat Arun, Chinese district, golden hill and box match AventureTv. Loading... Unsubscribe
20130429|http://www.youtube.com/watch?v=nmcdLOjGVzw|MIKA - Popular Song ft. Ariana Grande - YouTube|Popular Song is available for download on iTunes http://smarturl.it/MikaPopuarFtArianaIT To watch the exclusive Making Of the 'Popular Song
20100518|http://www.youtube.com/watch?v=7IkvAb6THQY|Far Away (with lyrics) - Red Dead Redemption|The Music of Red Dead Redemption Artist: Jose Gonzalez Track 16 This is the song that plays when you
20140808|http://www.youtube.com/watch?v=h564iMsYzqM|Good Time Girls (Démo) - Séverine Billy Bob's|Danse: Good Time Girls Chorégraphe: Karen Kennedy Musique: Good Time Girls de Nathan Carter
20160405|http://www.youtube.com/watch?v=K_zzay8A6VU|Vinhomes Golden River - YouTube|Video embedded Vinhomes Golden River - Dự Án Cảng Ba Son Quận 1 - Sông Xanh Đất Vàng - Duration: 6:32. Vinpearl - Villas  Condotel 2,414 views. 6:32.
20110319|http://prospectorstools.blogspot.com/2011/03/lost-treasures-of-northern-california.html|Gold Seekers Join Me: Lost Treasures of Northern California|Lost Treasures of Northern California ... The contest” continued until each and every one of the gold coins was either in the river or lodged into the
20110306|http://www.youtube.com/watch?v=lwIOyfg9aP0|Dog gets kicked off bridge - YouTube|Dog gets kicked off of bridge and guy gets upset, [Jack Black] falls off of bike from [Will Farrel]'s stupidity
20120226|http://www.youtube.com/watch?v=YVrdHP-7wXE|How to catch Yellow belly ( golden perch ) with|This is an example of bottom tapping with the Mazzy VIB' lure. It is one of the best techniques to catch yellow belly.
20120126|http://www.youtube.com/watch?v=Yocja_N5s1I|The Agricultural Revolution: Crash Course World|The Agricultural Revolution: Crash Course World History #1 CrashCourse. Loading... Unsubscribe from
20150424|http://www.youtube.com/watch?v=uK6aSGQ-7p8|Men Cutting Fallen Tree in River - Golden Darting Birds|Video embedded Men Cutting Fallen Tree in River - Golden Darting Birds HD maple1255. Loading ... Blue Ridge Timber Removes Hazard Tree from McKenzie River
20110405|http://www.youtube.com/watch?v=h1Q0ONEYJ0U|The Golden River Secrets of the Amazon - YouTube|The Golden River Secrets of the Amazon explorationfilms. ... Know as the Golden River it is host to
20121212|http://www.youtube.com/watch?v=UjMNen5Om6Q|Hello Josephine - Linedance - YouTube|Hello Josephine - Linedance caroza1. Loading... Unsubscribe from caroza1? Cancel Unsubscribe.
20100324|https://answers.yahoo.com/question/index?qid=20100324181939AAYI3Ar|willy wonka factory...is it real?  Yahoo Answers|Best Answer: The Willy Wonka factory does indeed exist. It is located south of Hogwarts school for wizards, right next to the ancient city of Atlantis
20141129|http://www.youtube.com/watch?v=zwvi6-BQ83M|Sailing Down This Golden River - YouTube|Sailing Down This Golden River - Arlo  Sarah Guthrie ... Pete Seeger - sailing down my golden river
20130425|http://www.youtube.com/watch?v=mr8OXLcW3xY|SimCity 5/2013 - How To Build Bridges,|... How To Build Bridges, Overpasses and Cuttings for Sunken Roads/Avenues AntneeUK. Loading
20170308|http://andy321.proboards.com/|Home  Rock Tumbling Hobby|Rock Tumbling Hobby. Home. Welcome to RTH! Introduce Yourself. New to the Forum. Board related discussions, testing, and technical help. Lapidary
20110910|http://www.youtube.com/watch?v=Hx8CTbGiV3s|Gold separator / sand concentrator - YouTube|Gold separator / sand concentrator Attila Blade. Loading ... Gold panning and High-banking at Shaolhaven River
20110223|http://www.youtube.com/watch?v=uZyWlcPt2IY|Devil Ship Pirates trailer - YouTube|Devil Ship Pirates trailer onnanob. Loading... ... Brian Trenchard Smith on Pirates Of Blood River - Duration:
20110504|http://www.youtube.com/watch?v=ktcFv5BqmZ8|THE ULTIMATE 'REAL FAIRY' VIDEO - YouTube|THE ULTIMATE 'REAL FAIRY' VIDEO PlanetDove. Loading... Unsubscribe from PlanetDove? Cancel
20160503|http://www.youtube.com/watch?v=nFRLwq-l1W8|River of Golden Dreams April 2016 - YouTube|Video embedded Jonny, James, Alex and Jess set off on an afternoon April float in the sun. That river sure feels cold when you fall in
20130702|http://www.youtube.com/watch?v=2jx7lW2tres|A journey in river Kushabhadra , Odisha and a hungry|Video embedded A journey in river Kushabhadra , Odisha and a hungry golden crab in beach Amit Siromoni. Loading... Unsubscribe from Amit
20120418|http://www.youtube.com/watch?v=hohZx-A2REw|Casa para la venta $ 63,900 3 habitaciones con|Casa en Venta en Poinciana, Florida de 3 habitaciones con 2 baños con un terreno de esquina muy
20100517|http://www.youtube.com/watch?v=X-Nl3-p8Vl0|Club Penguin Mission 11 Veggie Villain|http://club-penguin-secrets.com - Complete step-by-step walkthrough and guide for Club Penguin Mission 11,
20100504|http://treenotes.blogspot.com/2010/05/native-trees-with-smooth-bark.html|Tree Notes: Native Trees with Smooth Bark|Here is a list of five native trees with smooth bark, even in maturity: ... Herbert S. Zim. New York: Golden, 1986. Cliburn, Jerry, and Ginny Clomps.
20151228|http://www.youtube.com/watch?v=LA1qgRRnzRc|17606 Pete Seeger - Sailing Down My Golden|17606 Pete Seeger - Sailing Down My Golden River Lyrics. Skip navigation Sign in. ... 17606 Pete Seeger - Sailing Down My Golden River
20110625|http://www.youtube.com/watch?v=DlnE2vNqpTw|Don Williams - Tulsa time (+lyrics) - YouTube|Don Williams - Tulsa time With lyrics ... Sign up for YouTube Red by July 4th for uninterrupted music and
20140701|http://www.youtube.com/watch?v=lBjBUex90kY|Golden Retriever, Puppies, Dogs, For Sale, In|Golden Retriever, Puppies, Dogs, For Sale, In Anchorage, Alaska, AK, 19Breeders, Fairbanks 9BREEDERS. Loading... ... 25460 Eagle River Rd. Eagle River
20130815|http://www.youtube.com/watch?v=RRhjqqe750A|Growth, Cities, and Immigration: Crash Course US|... Check out CommonLit's free collection of reading passages and curriculum resources to learn more
20110824|http://www.youtube.com/watch?v=VtapoGukzCA|Jill Scott - Hear My Call (Official Video) - YouTube|Jill's emotionally charged video for the track Hear My Call off of her #1 album The Light of the Sun. Hear My Call
20151228|http://www.youtube.com/watch?v=1bWK7nCv6zc|Bienvenue à la Radio - Jungle Jack - Golden river (16/11|Video embedded Bienvenue à la Radio - Jungle Jack - Golden river (16/11/15) Riff - Radio rock. Loading... Unsubscribe from Riff - Radio rock? Cancel
20140127|http://www.youtube.com/watch?v=9ZOsS2jnJU8|Hobbit: Desolation of Smaug- The golden dragon|Sign up for YouTube Red by July 4th for uninterrupted music and ... Find out why Close. Hobbit: Desolation of Smaug- The golden
20151227|http://www.youtube.com/watch?v=CjFBJ63-w4s|(ROBLOX) Undertale Music ID's! [Check|I am back, once again! I shall start being helpful by being one of the first to share undertale music id's (for the
20160719|http://www.youtube.com/watch?v=eB212xa6Rxw|Sierra Gold Nurseries Yuba City, CA - YouTube|Sierra Gold Nurseries Yuba City, CA ... Bareroot tree production takes place in our nursery growing grounds alongside the Feather River
20141014|http://www.youtube.com/watch?v=65KgsHvFKd4|The Story of Moses - Beginners Bible - YouTube|The Story of Moses - Beginners Bible ... Encounter a time in ancient Egypt when Baby Moses was plucked from the reeds of the Nile River
20130515|http://www.youtube.com/watch?v=XAEiujYD4oY|The X Factor UK - Emotional Moments (1/4)|The X Factor UK - Emotional Moments (2/4 ... The X Factor UK - Emotional Moments (1/4) ... Emotional and Golden
20120624|http://www.youtube.com/watch?v=UY0PB4fBPbU|wild edibles: fresh water mussels - YouTube|wild edibles: fresh water mussels bushcraftmyway. Loading ... Ohio River Action:Fishing for
20131002|http://www.youtube.com/watch?v=nKhN1t_7PEY|Mr. Mister - Broken Wings - YouTube|Take these broken wings. Category Music; License Standard YouTube License; Music Broken Wings by Mr. Mister Listen ad-free with YouTube
20151209|http://www.youtube.com/watch?v=h7k2kGGQmlU|449 Golden River - 4K Video - YouTube|By Hometakes.com 449 Golden River Dr. Royal Palm Beach FL 33411.
20120126|http://www.youtube.com/watch?v=OTLYETKP9us|The Honest Woodcutter - Aesop's Fables In Tamil|Subscribe here:http://www.youtube.com/user/MagicboxT... MAGIC BOX ANIMATION PROUDLY PRESENTS Children Cartoon Stories Aesop's Fables
20101018|http://www.youtube.com/watch?v=1sV6xXIn2pM|On Heaven's Bright Shore - Gospel Song with|On Heaven's Bright Shore - Gospel Song with Lyrics VolunteersForTheLord. Loading ... Mix - On Heaven's Bright Shore - Gospel Song with Lyrics YouTube;
20120604|http://www.youtube.com/watch?v=kIicwZrkEhY|The Queens Diamond Jubilee Concert - Grace|The Queens Diamond Jubilee Concert outside Buckingham Palace London 04th June 2012 Grace Jones
20110526|http://www.youtube.com/watch?v=MUn6X9lpOZE|Charlie and the Chocolate Factory (3/5) Movie|Charlie and the Chocolate Factory movie ... to see the inside of his operation by placing golden tickets in five ... Chocolate River
20100520|http://www.youtube.com/watch?v=M6H-iik8_AE|Kayak Fishing - The 3 GOLDEN Rules - YouTube|Kayak Fishing - The 3 GOLDEN Rules KayakFishingTales. Loading... Unsubscribe from
20110128|http://www.youtube.com/watch?v=uKyn3FDaTYc|Scientific Verification of Vedic Knowledge *Full*|Scientific Verification of Vedic Knowledge *Full* videopostman. ... - Sarasvata River system ... The Coming Golden
20121209|https://answers.yahoo.com/question/index?qid=20121209081436AAvKGcd|How many people have killed themselves by jumping|How many people have killed themselves by jumping off Brooklyn Bridge? Has anyone ever done it? 1 following . 4 answers 4. Report Abuse.
20130403|http://bjordangemstones.blogspot.com/2013/04/precious-stones-of-bible.html|PRECIOUS STONES OF THE BIBLE - blogspot.com|PRECIOUS STONES OF THE BIBLE. ... which is the name of the river in Sicily where agate was mined in ... It ranges in color from golden yellow to
20120610|http://www.youtube.com/watch?v=6gdH7CBzRbY|Down the river of Golden Dreams - YouTube|Video embedded Okkervil River - Down The River Of Golden Dreams  It Ends With a Fall - Duration: 3:49. shelbithefro 2,190 views. 3:49. Okkervil River
20100324|http://www.youtube.com/watch?v=671AgW9xSiA|The Grateful Dead - Ripple (Studio Version)|Ripple  Playing For Change  Song Around The World - Duration: 4:42. Playing For Change 2,862,066 views. 4:42. Grateful Dead - Ripple
20100307|http://www.youtube.com/watch?v=QS1VlOkhskk|Country Gospel Music - Momma's Old Song Book|Country Gospel Music, Momma's Old Song Book, Gravel Road Gospel, Marvin Morrow, Strolling Down
20150118|http://www.youtube.com/watch?v=4UaR8Tv_zLA|Fnaf song 3 - YouTube|Fnaf song 3 Ruth Martinez. Loading... Unsubscribe from Ruth Martinez? Cancel Unsubscribe. Working... ... GOLDEN
20110922|http://www.bogley.com/forum/showthread.php?59303-Gold-in-the-Wind-Rivers-%28Trip-1%29|Gold in the Wind Rivers (Trip 1) - Bogley Outdoor|[Trip Report] Gold in the Wind Rivers (Trip 1) If this is your first visit, ... wind river golden trout, flying monkey wind river, gold of
20110414|http://www.youtube.com/watch?v=FkkrxPFl3hI|HOWRAH BRIDGE ON RIVER GANGA, KOLKATA,|Howrah Bridge's Incredible view from River Ganga . - Duration: 0:59. Saif Ali 7,697 views. 0:59. HOWRAH BRIDGE
20141021|http://www.youtube.com/watch?v=lVPONdZBh6s|Five Nights at Freddy's 2 Trailer - YouTube|Five Nights at Freddy's 1-5 Jumpscare Simulator *FNAF 2017* - Duration: 5:16. IULITM 111,175
20101005|http://jeffreycrane.blogspot.com/2010/10/dreg-series-russian-river-golden-sour.html|Dreg Series: Russian River Golden Sour - Jeffrey Crane|Dreg Series: Russian River Golden Sour This is one I have been patiently waiting to drink use. I have read about good results from using Russian River
20141012|http://www.youtube.com/watch?v=VkGPq-Wg_8Y|Skyrim Mods - Week 146 - THE WHEELS OF LULL|Skyrim Mods - Week 147 - Tania THE CUTEST ELF EVAR and WEED - Duration: 11:32. MxR Mods 1,070,244 views. 11:32. Skyrim Mods
20100820|http://www.youtube.com/watch?v=9rtHf9RdwhU|2010 Golden Girls Final - Tug River Princess & John Campbell|Video embedded Tug River Princess and John Campbell win in 1:49.3. ... 2010 Golden Girls Final - Tug River Princess  John Campbell Meadowlands
20110124|http://www.youtube.com/watch?v=BXInU1lTU64|Runrig Hearts Of Olden Glory - YouTube|Runrig Hearts Of Olden Glory jesuitten. Loading ... Every River - Live at Loch Ness ... Runrig Book of Golden
20100406|http://troutseeker.blogspot.com/2010/04/attacking-stonefly-hatch.html|SOUL OF STREAMS: ATTACKING A STONEFLY HATCH|I was wading up a river just after run-off had dropped it to a safer level. ... I like to attack the stonefly hatch. ... BRAIDED YELLOW/GOLDEN STONE NYMPH.
20130414|http://ruth-hiebert.blogspot.com/2013/04/eagles-and-more.html|Ruth's Photo Blog: Eagles and More|Eagles and More The time between ... Notice the broad straight wings of the Bald Eagle compared those of the Golden Eagle.Of course there are other
20120927|http://www.youtube.com/watch?v=lu_fLMQFZ_M|Kisaralik River Golden Gate Falls 2 - YouTube|Jason Gasper (at oars) and Josh Grahm shoot Golden Gate. We had just come through and the river was
20100811|http://www.youtube.com/watch?v=PnT067BM-bA|Randy Howard - Golden Fiddle Waltz - YouTube|Randy Howard - Golden Fiddle Waltz. Randy Howard - Golden Fiddle Waltz. Skip navigation ... Blue River
20120604|http://www.youtube.com/watch?v=_aDSaFgQkuM|Mariah Carey - I Can't Live Without You - YouTube|Mariah Carey - I Can't Live Without You SaraSun. Loading ... I CAN'T LIVE WITHOUT YOU WHITNEY
20101113|http://www.youtube.com/watch?v=65-_ocuGODM|Top 10 Bob Dylan Songs - YouTube|... Top 10 Bob Dylan Songs YouTube; I Got All the Bitches Baby - Otis Redding - Duration: 2:58. RetroTop10
20100119|http://www.youtube.com/watch?v=RZ66JMAicUE|Answers For You, Plus More - YouTube|Answers For You, Plus More Slooter93. Loading... Unsubscribe from Slooter93? Cancel Unsubscribe.
20131224|http://www.youtube.com/watch?v=ufpv87byPyU|Angry Birds Rio Rocket Rumble (Gold Rockets)|Rocket Rumble Gold Rocket bonus Level Goldene Rakete for,Iphone,Android,PC,IOS,Games,iPad New Uptade Golden
20130709|http://www.youtube.com/watch?v=A1pZyQSFZeI|WhiteWater Tubing Clear Creek Golden, CO|Tubing Clear Creek in Golden, Colorado GoPro Hero 3.
20140503|http://www.youtube.com/watch?v=B1pu28BBntI|Kış Uykusu (Winter Sleep) Trailer - YouTube|Kış Uykusu (Winter Sleep) Trailer guneslipazartesi. Loading ... 67. Cannes Film Festival (2014) The Golden
20120301|http://www.youtube.com/watch?v=Giwzo_tcu4U|2/5 MASTER POOL vs GOLDEN RIVER 1 - YouTube|Video embedded Unsubscribe from TREDICALCIO - Il canale del Biliardo Sportivo? ATTISANI-GUARRERA vs VENEZIANO -ONORI ( STAFFETTA
20130815|http://www.youtube.com/watch?v=qi39H0Jdjfg|John Legend - All Of Me Lyrics - YouTube|John Legend All Of Me Lyrics - Duration: 4:41. Conrad Martin 276,904,148 views. 4:41. 50+ videos Play all
20100126|https://answers.yahoo.com/question/index?qid=20100126195636AAYXEvd|What are some 100% legit online casino sites that pays|What are some 100% legit online casino sites that pays out real money? Anyone have those good sites, I know
20140503|http://www.riverdavesplace.com/forums/showthread.php?108267-Jacuzzi-YJ-Golden-Eagle-to-Berkeley-swap|Jacuzzi YJ Golden Eagle to Berkeley swap - River Dave's|River Dave\'s Place. The Jacuzzi YJ Golden Eagle is similar in design and installation method to what is termed an ... Jacuzzi YJ Golden Eagle to Berkeley swap
20130925|http://www.youtube.com/watch?v=Gvocx2QfWEk|ULTIMATE Train Video for children  Steam trains,|ULTIMATE Train Video for children  Steam trains, diesel trains, electric trains for kids C Hughes.
