20170628|https://www.trulia.com/rental/4025030744-1214-Tesla-Dr-Colorado-Springs-CO-80909|1214 Tesla Dr For Rent - Colorado Springs, CO  Trulia|1214 Tesla Dr, Colorado Springs, CO is a 4 bed, 2.5 bath, 2498 sq ft Single-family home available for rent in Colorado Springs, Colorado.
20170626|http://diyreconditionbatteryez.com/TeslaSolarBatteryWall=cs1561|# Tesla Solar Battery Wall - Solar Battery 6 Volt Vs 12|★ Tesla Solar Battery Wall - Solar Battery 6 Volt Vs 12 Volt Solar Battery Backup Kits Solar Powered Phone Battery Charger
20170627|https://www.chaffeybreeze.com/2017/06/27/covington-capital-management-has-304000-stake-in-tesla-inc-tsla.html|Covington Capital Management Has $304,000 Stake in Tesla|Covington Capital Management maintained its position in Tesla Inc. (NASDAQ:TSLA) during the first quarter, according to its most recent disclosure with the
20170630|https://www.pv-tech.org/news/teslas-solarcity-to-exit-south-carolina-market|Tesla’s SolarCity to exit South Carolina market  PV Tech|While Tesla will not accept new orders in South Carolina, it still plans to finish installing the PV systems that it has signed contracts for.
20170628|https://www.fool.com/investing/2017/06/28/tesla-motors-incs-most-brilliant-moves-in-2017-so.aspx|Tesla Motors, Inc.'s Most Brilliant Moves in 2017 So Far|Tesla Motors, Inc.'s Most Brilliant Moves in 2017 So Far Keeping investors looking to the future may be Elon Musk's real genius in business.
20170626|http://albawwaba.net/2017/06/26/433461-tesla-said-in-talks-with-labels-for-music-streaming-service/|Tesla Said in Talks With Labels for Music-Streaming|Tesla Inc. (NASDAQ:TSLA) now provides different services to its owners in its electric vehicles, but some of them are not meeting the requirements.
20170628|http://diyreconditionbatteryez.com/NicdBatterySolarBatteryBackup/TeslaGiantSolarBattery=cs2017.html|# Tesla Giant Solar Battery - Nature Power Solar Battery|★ Tesla Giant Solar Battery - Nature Power Solar Battery Chargers 5 Watt Solar Panels For Battery Charging Waterproof Solar Battery Controller
20170628|http://www.wral.com/judge-says-auto-dealer-group-can-challenge-tesla-dealership/16789520/|Judge says auto dealer group can challenge Tesla|RICHMOND, Va. — A Richmond Circuit Court judge has ruled that an auto dealers' group can challenge Virginia's approval for electric car company Tesla to
20170627|http://www.investopedia.com/news/amd-tops-tesla-biggest-short_squeeze/|AMD Tops Tesla for Biggest Short Squeeze of the Week|Move over Tesla Inc. (TSLA), we have a new biggest loser. For the week ending June 23, Advanced Micro Devices Inc. (AMD) was the
20170626|https://pakistanclip.pk/2017/06/26/tesla-enter-music-streaming-scene/|Tesla To Enter Music Streaming Scene?|Tesla To Enter Music Streaming Scene? - Breaking, Technology , Business, Health, World, Pakistan, Video News Of Pakistan and International
20170630|http://fortune.com/2017/06/30/elon-musk-tesla-model-3-release-date/|Elon Musk Teases Tesla Model 3 Release Date|Tesla CEO Elon Musk says news on the Model 3, which is expected to retail $35,000 at lowest, is coming July 4th weekend.
20170630|http://www.thehindu.com/sci-tech/technology/gadgets/tesla-may-have-model-3-related-news-on-sundaymusk/article19188629.ece|Tesla may have Model 3-related news on Sunday:Musk|Electric car maker Tesla Inc may have an announcement related to the release date of its first mass-market Model 3 sedan on Sunday. Tesla Chief Executive
20170628|http://www.theoptionsinsider.com/tesla-options-tracker-june-28-2017/|Tesla Options Tracker: June 28, 2017The Options Insider|The Tesla Options Tracker is a snapshot of all the $TSLA options info that you need to know. Most Active TSLA Options. 5588 TSLA
20170626|https://www.youtube.com/watch?v=ICHksyRCIdc|Tesla P90D Ludicrous vs. YouTubers!! - YouTube|Today we do some ludicrous reactions in my 2016 Tesla Model X P90D. The launches were hilarious! Stephens Channel: . Tesla Model S P90D Ludicrous vs BMW i8
20170628|https://seekingalpha.com/article/4084582-problem-teslas-competition|The Problem With Tesla's Competition - Tesla Motors|Numerous companies have recently announced plans to electrify all or part of their fleets in hopes to compete with Tesla and satisfy the large demand for
20170626|https://www.themarketsdaily.com/2017/06/26/tesla-inc-tsla-stake-boosted-by-old-mutual-customised-solutions-proprietary-ltd.html|Tesla Inc. (TSLA) Stake Boosted by OLD Mutual|OLD Mutual Customised Solutions Proprietary Ltd. boosted its position in Tesla Inc. (NASDAQ:TSLA) by 10.3% during the first quarter, according to its most
20170627|http://www.businessinsider.com/tesla-stock-price-music-streaming-elon-musk-2017-6|Tesla music streaming would make sense, Morgan|Tesla, the electric-car and energy-storage company, could become the next big music-streaming service.
20170628|https://www.yahoo.com/news/tesla-hardware-2-functions-autopilot-dont-143000323.html|Tesla Hardware 2: so what functions work in Autopilot|The expanded collection of sensors known as Hardware 2 continues to bring new and revamped features to the Tesla Model S and Model X electric cars.
20170626|https://www.trulia.com/property/3273055132-73-Tesla-Ridge-Way-Las-Vegas-NV-89183|73 Tesla Ridge Way For Sale - Las Vegas, NV  Trulia|See 73 Tesla Ridge Way, Las Vegas, NV photos, maps, and listing information. See neighborhood info and school district insight for this property and Las
20170626|https://www.vox.com/the-big-idea/2017/6/26/15872468/tesla-gm-ford-valuation-justifying-disruption|Why Tesla is overhyped — and overvalued - Vox|Recently, Tesla’s valuation surpassed both Ford’s and General Motors’. BMW is among the other major carmakers in the rearview mirror. The logic of
20170627|https://www.ebth.com/items/6170547-vizio-39-tesla-50-television|Vizio 39 Tesla 50" Television : EBTH|A Vizio 39 Tesla 50" television, model E500i-A1 and serial number LTYWNTBP3356762. A power cord and remote control are included, but its original base and
20170628|http://doncorpwriters.com/2017/06/28/tesla-planning-double-network-superchargers-2017/|Tesla Planning to Double Network of Superchargers in|Elon Musk’s Tesla Motors (NASDAQ: TSLA) is planning to double the number of filling stations for electric cars it operates
20170626|https://www.bloomberg.com/news/articles/2017-06-26/tesla-effect-boosts-shares-of-little-known-lithium-salt-supplier|Tesla's Needs Transformed This Obscure Japanese|Tesla Inc.’s ambitions grew and China tried to cut its greenhouse emissions with plans to put millions of cars on the road that use little or no gasoline.
20170627|https://www.thewallstreetchronicle.com/2017/06/27/tesla-inc-to-announce-q2-deliveries-what-to-expect/|Tesla, Inc. to Announce Q2 Deliveries: What to Expect|Image source: author. What to expect. For the first half of 2017, Tesla said it expected a big year-over-year jump in vehicle deliveries. Management guided
20170627|http://minecraft-mp.com/server-s165223|Tesla.pvp  Minecraft server|Tesla.pvp, a minecraft server, located in Brazil ... You can also share this server with the following social links to help you get more players.
20170626|http://www.businessinsider.com/i-drove-my-first-tesla-six-years-ago-and-i-just-drove-the-same-car-again-2017-6|Tesla Roadster: REVIEW - Business Insider|Brings me back. Matthew DeBord/Business Insider. You never forget your first Tesla. In 2010, right after the company had survived a near-death experience
20170629|http://www.investopedia.com/news/tesla-ipo-7-years/|Tesla IPO: 7 Years On  Investopedia|In February of 2009, 16 months before its IPO, Tesla sold its first car, the Tesla Roadster, the first highway legal all-electric car. At
20170626|https://www.electrive.com/2017/06/26/eu-quota-smart-volkswagen-tesla-hyundai-renault/|electrive.com » EU-Quota, Smart, Volkswagen, Tesla|EU electric quota this year? The EU commission is about to introduce EV sales quota among a new set of rules to reduce CO2 emissions from transport
20170628|https://speakerdeck.com/burcudurmusoglu/tesla-motors-strategic-audit|Tesla Motors- Strategic Audit // Speaker Deck|Tesla Motors- Strategic Audit by Burcu Durmusoglu. Published June 28, 2017 in Business. Burcu Durmusoglu. 6 Presentations. Star this Talk 0 Stars
20170627|https://www.autofreaks.com/news/tesla-close-to-opening-a-factory-in-china/|Tesla close to opening a factory in China - Autofreaks.com|Tesla is close to coming to an agreement to set up a factory in China, its first outside of the US to built their famous electric cars
20170626|http://accesswdun.com/article/2016/10/457070|Tesla, SolarCity shareholders to vote on merger next mo|PALO ALTO, Calif. (AP) — Tesla Motors CEO Elon Musk faces a referendum next month, as shareholders decide whether to support his vision and combine Tesla
20170627|https://www.diorama.com/2017/06/27/nikola-tesla-expo-perth/|Nikola Tesla EXPO to Perth - Diorama|Nikola Tesla EXPO to Perth. Tesla Forum WA is once more bringing the Nikola Tesla EXPO to Perth.The Expo will be held at the Perth Town Hall 1-16 July 2017.
20170629|http://www.jlaforums.com/viewtopic.php?t=377785236&start=60|Maybe OT Tesla - Page 7 - JLA FORUMS|couldn't come close to the tesla, you mean. <http> We all understand acceleration. Its the rate of change of velocity. This 4,891-pound Tesla Model S
20170626|https://www.electrive.com/2017/06/26/tesla-faraday-future/|electrive.com » Tesla, Faraday Future.|Reading tip: Tesla is working on a music streaming service of its own and allegedly started talks with big music labels already. The company’s idea is to
20170627|http://diyreconditionbatteryez.com/PriceOfBatteriesForStoringSolarPower/TeslaLithiumSolarBattery=cs2020|# Tesla Lithium Solar Battery - How Do You Dispose Of|★ Tesla Lithium Solar Battery - How Do You Dispose Of Old Computer Batteries How Long To Recharge A Car Battery How Are You Supposed To Dispose Of Batteries
20170626|https://www.yahoo.com/news/tesla-finds-chinese-production-electric-cars-shanghai-130000758.html|Tesla finds Chinese production site for electric cars|Tesla is closing in on a deal to begin production of its cars in China, after it signed a preliminary agreement to explore building cars near the major
20170626|http://fox5sandiego.com/2017/06/26/driver-dies-after-colliding-with-tesla/|Driver dies after turning into path of Tesla in Rancho|A man was killed Sunday evening when he lost control of his vehicle and was hit by a Tesla in Rancho Santa Fe.
20170626|http://www.graffiotech.com/2017/06/26/tesla-reportedly-in-talks-with-labels-for-music-streaming/|Tesla Reportedly In Talks With Labels For Music|Tesla Reportedly In Talks With Labels For Music-Streaming Service . Microsoft Surface Pro 5 New Leak Reveals Release Date, Features, Price, & Specs
20170629|http://www.orlandosentinel.com/classified/realestate/os-lake-nona-apartments-20170629-story.html|Tesla ride shares, micro units set for Lake Nona project|Pixon apartments in Lake Nona are set to include Tesla ride shares, micro units (Tavistock Development Group)
20170627|https://synergycap1.com/archives/73075|Why Tesla Is Worth More Than GM - Synergy Capital|A few companies that master digital technologies are capturing huge chunks of the economy. Does this explain the persistence of slow growth?
20170629|https://www.wealthdaily.com/articles/tesla-beating-microcap-registers-first-volume-order-for-powerwall-rival/8759|Tesla-Beating Microcap Registers First Volume Order for|Last week I wrote to you about a tiny tech company whose line of Powerwall-rivaling domestic energy storage units is now threatening Tesla's
20170629|http://www.jlaforums.com/viewtopic.php?t=377785236&start=50|Maybe OT Tesla - Page 6 - JLA FORUMS|Digital - Cameras, Printers and Scanners - In article <oj3hqq>, PAS <abc> wrote: Quote: there are numerous vehicles that cost about what a tesla
20170627|https://teslamotorsclub.com/blog/2017/06/27/morgan-stanley-analyst-says-tesla-streaming-service-makes-sense/|Morgan Stanley Analyst Says Tesla Streaming Service|News that Tesla may launch its own music streaming service was met last week with confusion. But, Morgan Stanley analyst Adam Jonas says autonomy will make
20170630|http://realmoney.thestreet.com/articles/06/30/2017/tesla-pay-more-attention-price-action-and-less-elon-musks-tweets|Tesla: Pay More Attention to the Price Action and Less|Fans of Tesla Inc. are sitting on the edge of their chairs waiting for a weekend announcement anticipated for this Sunday from Elon Musk. I am happy with
20170626|https://seekingalpha.com/article/4083940-tesla-grapples-gargantuan-regulatory-state|Tesla Grapples With The Gargantuan Regulatory State|Tesla is facing an array of regulatory issues which must be resolved before mass production and commercialization of autonomous, electric vehicles can
20170626|https://seekingalpha.com/article/4084022-tesla-case-missing-inventory|Tesla And The Case Of Missing Inventory - Tesla Motors|Proper inventory management at Tesla appears to be a continuing issue that's getting worse. Units are sitting at delivery centers for weeks before appearing on
20170628|https://www.youtube.com/watch?v=WkTJFat-ZHY|Tesla at Summerfest 2017 (LIVE) 2017 - YouTube|Tesla at Summerfest 2017 HD 1080p Date : June 2017 Watch Live Here : http://mcaf.ee/862vyw Subscribe My Channel
20170626|https://techdigg.com/2017/06/26/this-hangover-cure-drink-is-so-successful-its-maker-had-to-quit-tesla/|This Hangover Cure Drink is So Successful its Maker Had|If you’re a well respected engineer at Tesla, it’s likely you’ll be pretty happy with your job and won’t be looking to leave. That was the case for
20170628|https://www.nettiauto.com/en/tesla/model-s/8920336|Tesla Model S P100D Ludicrous 922hv Autopilot2 Hinta|Nyt myynnissä Tesla Model S P100D Ludicrous 922hv Autopilot2 Hinta Sis.ALV 24% Tehdastakuu, 100 km, 2017 - Vantaa. Klikkaa tästä kuvat ja lisätiedot
20170626|https://newscarspreview.com/2017-tesla-roadster-review-specs-release-date-and-price/|2017 Tesla Roadster, Specs, Price, 2.5 Sport, Top Speed|2017 Tesla Roadster Review, Specs, Release Date, and Price - The company Tesla has released the release of a new model of Roadster second era. Electronic cars
20170628|http://m.industryweek.com/continuous-improvement/tesla-will-have-tough-time-ramping-production-heres-why|Tesla Manufacturing Production Problems  Lean|In 2010, Tesla famously acquired the NUMMI plant previously owned jointly by GM and Toyota for the rock-bottom price of $42 million.
20170627|http://planetsixstring.com/proposed-tesla-music-service-not-what-everyone-thinks/|Proposed Tesla Music Service Not What Everyone Thinks|Although rumors about a new Tesla streaming service have been flying thick and fast, the truth may be something rather different. While Tesla has indeed been
20170628|https://twitter.com/TeslaMotors|Tesla (@TeslaMotors)  Twitter|6,318 tweets • 1,095 photos/videos • 1.49M followers. "Tesla Model X is the first SUV ever to receive a 5-Star safety rating in every category https
20170630|http://www.businessinsider.com/tesla-shares-have-hit-a-speed-bump-2017-6|Tesla shares have hit a speed bump - Business Insider|After rallying almost 80% since the beginning of the year — and looking like $400 might be in sight — Tesla shares have retreated over the past week to
20170630|http://www.cnbc.com/2017/06/30/tesla-model-3-release-date-elon-musk-says-news-on-sunday.html|Tesla Model 3 release date: Elon Musk says there will be|Tesla Chief Executive Elon Musk said on Friday that he will make an announcement on the weekend about the release date for the highly-anticipated Model
20170627|https://www.fool.com/investing/2017/06/27/tesla-inc-starts-selling-tesla-branded-solar-panel.aspx|Tesla, Inc. Starts Selling Tesla-Branded Solar Panels in|Tesla, Inc. Starts Selling Tesla-Branded Solar Panels in Its Stores Tesla hopes its rebranded solar products will drive revenue and cost synergies.
20170626|http://thealt.com/2017/06/26/nikola-tesla-drops-beat-electric/|"Nikola Tesla Drops the Beat" is electric - The Alt|Amy Durant reviews "Nikola Tesla Drops the Beat" at Adirondack Theatre Festival to be exciting and well cast.
20170626|http://diyreconditionbatteryez.com/Coin.Batteries.For.Solar.Lights/TeslaSolarBatteriesForHomesCost=cs1570.htm|# Tesla Solar Batteries For Homes Cost - Energizer Max|★ Tesla Solar Batteries For Homes Cost - Energizer Max 12 Volt Car Battery Menards Car Batteries 6v Battery Powered Ride On Bumper Car
20170628|http://m.industryweek.com/continuous-improvement/tesla-will-have-tough-time-ramping-production-heres-why|Tesla Manufacturing Production Problems  Lean|In 2010, Tesla famously acquired the NUMMI plant previously owned jointly by GM and Toyota for the rock-bottom price of $42 million. What it didn’t get
20170628|http://www.gospelherald.com/articles/71037/20170628/tesla-stores-now-sell-branded-solar-panels.htm|Tesla Stores Now Sell Tesla-Branded Solar Panels|Tesla Inc. has started to sell their very own brand of Tesla solar panels in their stores, and hope that these rebranded solar products will be an engine
20170627|https://seekingalpha.com/article/4083991-tesla-overvalued-diminished-prospects-profitability|Tesla Overvalued On Diminished Prospects Of|When factoring full capacity utilization and gross margin figures in-line with high-end automakers, Tesla’s valuation still seems stretched.
20170627|http://motamuseum.com/2017/06/27/zmagovalca-nagrade-tesla-plateauresidue/|TESLA Award Winners: PLATEAURESIDUE - MoTAMoTA|TESLA Award is a new competition in Slovenia focusing on new and progressive art forms, what we call transdisciplinary or intermedia art, in order to
20170627|http://investorplace.com/2017/06/tesla-inc-tsla-stock-bubble/|Tesla Inc (TSLA) Stock Is a Bubble Stock, Plain and|Tesla may or may not make money some day, but right now, TSLA stock is in a bubble, far removed from fundamental analysis.
20170628|http://www.yankodesign.com/2017/06/28/neuroon-open-sleep-assistant/|Hack your Sleep like Nikola Tesla  Yanko Design|Nikola Tesla, Leonardo da Vinci, Salvador Dali, Thomas Edison, Napoleon Bonaparte, and Buckminster Fuller. Do you know what all
20170627|https://www.electrive.com/2017/06/27/nhtsa-tesla-roadster/|electrive.com » NHTSA, Tesla Roadster.|electrive.com is an industry service for electric mobility industry. The newsletter “electrive.com today” is published every workday and reports on the
20170626|http://www.theluxonomist.es/2017/06/26/when-tesla-surpassed-bmw/abel-amon?lang=en|When Tesla Surpassed BMW|A few months ago Tesla, the innovative company of Elon Musk, had outperformed Ford. Last week, the Palo Alto company surpassed BMW and became the fourth
20170626|http://www.datamyne.com/blog/exports/tesla-electric-vehicles-exports-gain-in-2016/|Tesla Electric Vehicles Exports Gain in 2016  Datamyne|A new free report from Descartes Datamyne provides trade data on Tesla electric vehicles exports, including Model S and Model X, volumes and country
20170628|https://www.glassdoor.com/Interview/Tesla-Equipment-Engineer-Interview-Questions-EI_IE43129.0,5_KO6,24.htm|Tesla Equipment Engineer Interview Questions  Glassdoor|4 Tesla Equipment Engineer interview questions and 1 interview reviews. Free interview details posted anonymously by Tesla interview candidates.
20170628|https://seekingalpha.com/article/4084554-tesla-drops-bomb-shareholders-owners|Tesla Drops A Bomb On Shareholders And Owners - Tesla|Well it is that time of quarter again and Tesla is in a last minute rush to move units out the door and off to customer garages. Just after midnight Monday
20170628|http://www.therepublic.com/2017/06/28/va-tesla-dealership/|Judge says auto dealer group can challenge Tesla|RICHMOND, Va. — A Richmond Circuit Court judge has ruled that an auto dealers’ group can challenge Virginia’s approval for electric car company Tesla
20170627|https://seekingalpha.com/article/4084233-high-multiples-negative-earnings-proving-toxic-tesla|High Multiples, Negative Earnings Proving To Be Toxic|Tesla's negative earnings are proving to be toxic for a fundamental investor as its earnings yields fail to beat interest rates. Tesla's valuation trading
20170627|http://www.freepatentsonline.com/D790742.html|Vehicle headlight - Tesla Motors, Inc.|FIG. 1 shows a front view of a vehicle headlight. FIG. 2 is a side view thereof. FIG. 3 is a perspective view thereof; and, FIG. 4 is a top view thereof.
20170628|https://www.dailypolitical.com/2017/06/28/tesla-inc-tsla-short-interest-update.html|Tesla Inc. (TSLA) Short Interest Update  Daily Political|Tesla Inc. (NASDAQ:TSLA) saw a large drop in short interest in the month of June. As of June 15th, there was short interest totalling 29,049,111 shares, a
20170627|https://www.themarketsdaily.com/2017/06/27/financial-contrast-tesla-tsla-vs-honda-motor-company-hmc.html|Financial Contrast: Tesla (TSLA) vs. Honda Motor|Tesla (NASDAQ: TSLA) and Honda Motor Company (NYSE:HMC) are both large-cap auto/tires/trucks companies, but which is the better stock? We will compare the
20170627|https://mindyourmajor.com/2017/06/27/episode-8-tesla-manager-and-house-flipper-marcus-schwab/|Episode 8: Tesla Manager and House Flipper Marcus|28 year old Marcus Schwab is a former showroom manager at Tesla Motors and is currently flipping a house for profit with his bare hands! This episode is
20170627|https://www.reddit.com/user/tesla_lover123|overview for tesla_lover123 - reddit.com|reddit gold gives you extra features and helps keep our servers running. We believe the more reddit can be user-supported, the freer we will be to make
20170626|http://www.snorkernews.com/2017/06/26/2017-tesla-model-x/|2017 Tesla Model X  Snorker News|After a rocky launch, the Tesla Model X SUV is seemingly on its (silent) way into many owners’ hands. It’s too early for 2017 details—the automaker
20170629|http://www.businessinsider.com/again-tesla-model-3-design-different-chevy-bolt-2017-6|How Tesla Model 3 design differs from Chevy Bolt|The Tesla Model 3 and the Chevy Bolt are both long-range, all-electric cars for the people, but they embody very different design philosophies.
20170627|http://www.businessinsider.com/tesla-model-3-elon-musk-electric-car-vehicle-2017-6|Tesla's Model 3 is coming in July — here's everything|Tesla is gearing up for the big reveal of the Model 3, its first mass-market car. CEO Elon Musk unveiled the car in March of 2016, but Tesla will show off
20170628|http://www.investopedia.com/news/tesla-could-be-living-room-wheels-music-streaming-tsla-aapl/|Tesla Could Be 'Living Room on Wheels' With Music|Could electric car maker Tesla, Inc. (TSLA) become a content company? That prospect may not sound that outlandish after a recent report by Morgan
20170628|http://mashable.com/2017/06/28/porsche-driver-spins-out-racing-tesla/|Poor Porsche completely spins out trying to keep up|Here is something you probably thought you'd never see: a Porsche absolutely spinning out trying to keep up with a Tesla. A TESLA.
20170628|https://stockmarketlive.tv/2017/06/28/ken-blocks-gymkhana-nine-tesla-sell/|Ken Block’s GYMKHANA NINE: TESLA IS A SELL|After unloading Tesla investment position at $383 making the announcement on the Live Blog, the company established a new strategic partnership. Tesla new
20170626|https://thestocktimes.com/2017/06/26/lattner-revealed-tesla-transforming-itself-into-a-big-data-company/|Lattner revealed Tesla transforming itself into a big data|An ex-Tesla exec reveals that the company is transforming itself into a big data powerhouse. In a statement Lattner said.. "One of Tesla's huge advantages
20170628|http://investorplace.com/2017/06/tesla-inc-tsla-stock-model-3-oil-prices/|Will Oil Prices Spoil Tesla Inc's (TSLA) Model 3 Party|Tesla Inc (NASDAQ:TSLA), the leading EV manufacturer in the U.S., is slated to launch the final Model 3 sometime in July, a couple of weeks from now. Tesla
20170626|http://thevillagessuntimes.com/2017/06/26/tesla-wants-to-enter-music-streaming/|Tesla wants to enter music streaming|Tesla, which has sold over 100,000 cars till date, may find it hard to convince drivers to use its own streaming service over Spotify or Apple Music for
20170629|https://seekingalpha.com/article/4084910-tesla-redefines-home-energy|Tesla Redefines Home Energy - Tesla Motors|Green Mountain Power Corp. partners with its customers to begin installing Tesla Powerwall home batteries. Who are the winners and losers in the
20170626|http://www.businessinsider.com/tesla-chris-lattner-explains-how-car-data-is-used-2017-6|Ex-Tesla exec Chris Lattner explains how car data is used|Tesla ramped up its efforts to become a big data company under Chris Lattner, one of Apple's most famous developers who left the electric carmaker last
20170626|https://www.washingtonpost.com/news/the-switch/wp/2017/06/23/tesla-wants-to-develop-its-own-music-service/|Tesla reportedly wants to develop its own music service|It may not be enough for the electric-car company Tesla to take on the giants of Detroit, like General Motors and Ford. The Palo Alto-based automaker is
20170628|http://diyreconditionbatteryez.com/Solar.Storage.Battery.Companies/TeslaSolarRoofBattery=cs2025.htm|# Tesla Solar Roof Battery - Discount Battery Candles|★ Tesla Solar Roof Battery - Discount Battery Candles 48v Club Car Ds 2 Gauge Battery Cables 07 Nissan Sentra Car Batteries
20170628|http://www.stocksgallery.com/2017/06/28/nabors-industries-ltd-nbr-is-at-8-03-per-share-and-tesla-inc-tsla-is-listed-at-362-37/|Nabors Industries Ltd. (NBR) is at $8.03 per share and|Hot Stocks; Nabors Industries Ltd. (NBR) is at $8.03 per share and Tesla, Inc. (TSLA) is listed at $362.37
