20170628|https://www.fool.com/investing/2017/06/28/why-tesla-inc-is-moving-into-china.aspx|Why Tesla Inc Is Moving Into China -- The Motley Fool|Why Tesla Inc Is Moving Into China To reach the ambitious goal of 500,000 cars per year, Musk is going to have to make concessions as he enters a crucial
20170627|https://www.electrive.com/2017/06/27/tesla-audi-schaeffler-france-bmw-ford/|electrive.com » Tesla, Audi, Schaeffler, France, BMW, Ford.|Tesla increases credit line: 800m have been added to Tesla’s creditline as the EV maker’s need for cash increases closer to the Model 3 launch.
20170630|http://www.investopedia.com/news/tesla-stock-gearing-model-3-launch/|Tesla Stock Is Gearing Up For The Model 3 Launch|Tesla Inc. (TSLA) could have an exciting first few days of July with the expected launch of the Model 3, its first mass-market electric car.
20170627|https://www.tripadvisor.com/ShowUserReviews-g294454-d7694983-r496641262-TESLA_Power_House-Zagreb_Central_Croatia.html|Dissapointment - Review of TESLA Power House, Zagreb|TESLA Power House: Dissapointment - See 44 traveler reviews, 14 candid photos, and great deals for Zagreb, Croatia, at TripAdvisor.
20170626|http://diyreconditionbatteryez.com/Battery.For.Smart.Car/Tesla.Car.Battery.Capacity=cc6768.htm|# Tesla Car Battery Capacity - Club Car Precedent|★ Tesla Car Battery Capacity - Club Car Precedent Battery Gauge Wires Battery Dies When Car Is Off Low Charge On Car Battery
20170626|http://247wallst.com/autos/2017/06/26/has-tesla-got-enough-to-fund-its-model-3/|Tesla Finds New Funding for Model 3 (NASDAQ: TSLA)|Tesla is looking for funding again. This is the second time in roughly six months that Elon Musk is trying to power his electric car.
20170628|http://investorplace.com/2017/06/wednesday-vital-data-nvidia-corporation-nvda-tesla-inc-tsla-alibaba-group-holding-ltd-baba/|Wednesday’s Vital Data: Nvidia Corporation (NVDA), Tesla|Nvidia (NVDA) pressured by cryptocurrencies, Tesla (TSLA) options traders nervous ahead of report and JPMorgan bullish on Alibaba (BABA).
20170628|https://www.yahoo.com/news/bmw-competing-tesla-introduce-electric-3-series-handelsblatt-183146480--finance.html|BMW, competing with Tesla, to introduce electric 3|FRANKFURT (Reuters) - BMW plans to introduce an electric version of its popular 3 Series in September, a move designed to fend off rival Tesla
20170626|https://linkto-blog.com/2017/06/26/tesla-music-streaming-service-for-cars/|Tesla Music Streaming Service for Cars. REVIEWS and|Tesla wants to create a music streaming service for cars. Musk is going to start with integrating the Internet radio into the multimedia system
20170627|https://www.fool.com/investing/2017/06/27/tesla-inc-to-announce-q2-deliveries.aspx|Tesla, Inc. to Announce Q2 Deliveries: What to Expect|Tesla, Inc. to Announce Q2 Deliveries: What to Expect Are Model 3 pre-orders cannibalizing some Model S sales?
20170627|http://diyreconditionbatteryez.com/Using.Batteries.For.Solar.Power/New.Tesla.Battery.For.Solar=cs1574.asp|# New Tesla Battery For Solar - Choosing Batteries For|★ New Tesla Battery For Solar - Choosing Batteries For Solar System Coleman 5 Watt Solar Battery Charger 12 Volt Battery Solar System